file_id,sentence_text,A0,B1,NE_score_binary,C_score_binary,ALL_score_binary,lexicoder_words_polarity,lexicoder_score,lexicoder_score_binary
UNSC_2014_SPV.7219_spch025_Indonesia_neg%2000.txt,"As a matter of priority ,  on behalf of the Government and the people of Indonesia ,  I wish to express our deepest condolences to all affected nations ,  especially our good neighbour Malaysia ,  over the deaths of the 298 civilian passengers and crew aboard Malaysia Airlines Flight MH-17 ,  which crashed yesterday  as it was flying over eastern Ukraine .  ",_,_,0,0,0,"[('affected', 'negative'), ('death', 'negative'), ('behalf', 'positive'), ('civil', 'positive'), ('good', 'positive')]",0.017857142857142856,0
UNSC_2014_SPV.7219_spch025_Indonesia_neg%2000.txt,"As the Council may be aware ,  12 Indonesian citizens were confirmed among the deceased .  ",_,_,0,0,0,"[('decease', 'negative'), ('confirm', 'positive')]",0.0,0
UNSC_2014_SPV.7219_spch025_Indonesia_neg%2000.txt,Our thoughts and prayers are with the families of the victims .  ,_,_,0,0,0,"[('victim', 'negative')]",-0.09090909090909091,1
UNSC_2014_SPV.7219_spch025_Indonesia_neg%2000.txt,Allow me also to take this opportunity to sincerely thank the delegations that have expressed their sympathy and condolences to Indonesia .  ,_,_,0,0,0,"[('opportunity', 'positive'), ('sincer', 'positive'), ('sympathy', 'positive'), ('thank', 'positive')]",0.19047619047619047,0
UNSC_2014_SPV.7219_spch025_Indonesia_neg%2000.txt,"According to various sources and reports ,  the airplane was presumably shot down by a surface - to - air missile .  ",_,_,0,0,0,[],0.0,0
UNSC_2014_SPV.7219_spch025_Indonesia_neg%2000.txt,"If that is indeed the case , such a heinous act is tantamount to a grave violation of international law ,  in particular international humanitarian law .  ",_,_,0,0,0,"[('grave', 'negative'), ('grave', 'negative'), ('heinous', 'negative'), ('violat', 'negative'), ('humanitarian', 'positive')]",-0.125,1
UNSC_2014_SPV.7219_spch025_Indonesia_neg%2000.txt,"In that regard , Indonesia calls upon the Security Council to take immediate steps  to enable a thorough , transparent and independent international investigation to be conducted upon this horrendous incident .  ",_,_,0,0,0,"[('horr', 'negative'), ('thorough', 'positive')]",0.0,0
UNSC_2014_SPV.7219_spch025_Indonesia_neg%2000.txt,Indonesia stands ready to join and support such an investigation .  ,_,_,0,0,0,"[('join', 'positive'), ('ready', 'positive'), ('support', 'positive')]",0.3,0
UNSC_2014_SPV.7219_spch025_Indonesia_neg%2000.txt,"If the investigation concludes that the crash was indeed intentionally caused by human factors ,  be it a missile strike or otherwise ,  Indonesia demands that the perpetrators of such a heinous and inhuman crime be brought to justice to the fullest extent of the law .  ",_,_,0,0,0,"[('crime', 'negative'), ('heinous', 'negative'), ('inhuman', 'negative')]",-0.06818181818181818,1
UNSC_2014_SPV.7219_spch025_Indonesia_neg%2000.txt,"As a precautionary measure , yesterday my President instructed all Indonesian airlines to exercise the utmost caution  and to avoid the airspace in and around conflict areas ,  including that of Ukraine .",_,_,0,0,0,"[('avoid', 'negative'), ('conflict', 'negative'), ('precaution', 'positive')]",-0.03333333333333333,1
UNSC_2014_SPV.7154_spch019_Ukraine_00_GD.txt,"I thank you , Madam President , for this opportunity to speak before the Security Council .  ",_,_,0,0,0,"[('opportunity', 'positive'), ('thank', 'positive')]",0.14285714285714285,0
UNSC_2014_SPV.7154_spch019_Ukraine_00_GD.txt,I thank Council members for understanding the critical situation in Ukraine and for their support .  ,_,_,0,0,0,"[('critic', 'negative'), ('support', 'positive'), ('thank', 'positive'), ('understand', 'positive')]",0.13333333333333333,0
UNSC_2014_SPV.7154_spch019_Ukraine_00_GD.txt,"Before getting into the substance of my statement this evening ,  I would like start by mentioning that today Christians worldwide celebrate a great holiday , the day of the entry of our Lord into Jerusalem , Palm Sunday .  ",_,_,0,0,0,"[('celebrat', 'positive'), ('great', 'positive'), ('holiday', 'positive'), ('like', 'positive')]",0.1111111111111111,0
UNSC_2014_SPV.7154_spch019_Ukraine_00_GD.txt,"Unfortunately , today the celebration is falling under the shadow of aggression and bloodshed in Ukraine .  ",Direct_NegEval,_,1,0,1,"[('aggress', 'negative'), ('blood', 'negative'), ('shadow', 'negative'), ('unfortunat', 'negative'), ('celebrat', 'positive')]",-0.2,1
UNSC_2014_SPV.7154_spch019_Ukraine_00_GD.txt,"On the eve of the holiday , terrorists coordinated by agents of the Russian Federation seized control of State buildings in several cities of the Donetsk region .",Direct_NegEval,_,1,0,1,"[('seiz', 'negative'), ('terror', 'negative'), ('coordinated', 'positive'), ('holiday', 'positive')]",0.0,0
UNSC_2014_SPV.7138_spch009_China_00.txt,The current situation in Ukraine is highly complex and sensitive  and has regional and international repercussions .  ,_,_,0,0,0,"[('sensitiv', 'positive')]",0.0625,0
UNSC_2014_SPV.7138_spch009_China_00.txt,The international community should together engage in pushing through a political solution to the crisis in Ukraine  so as to truly maintain peace and stability in the region .  ,_,_,0,0,0,"[('crisi', 'negative'), ('peace', 'positive'), ('stabili', 'positive')]",0.03571428571428571,0
UNSC_2014_SPV.7138_spch009_China_00.txt,What we are seeing Ukraine today is the result of a complex intertwinement of historical and contemporary factors .  ,_,_,0,0,0,[],0.0,0
UNSC_2014_SPV.7138_spch009_China_00.txt,"The situation in Ukraine ,  which seems to be accidental ,  has elements of the inevitable ,  and therefore calls for a comprehensive and balanced solution .  ",_,_,0,0,0,"[('accident', 'negative'), ('balance', 'positive'), ('comprehensiv', 'positive')]",0.043478260869565216,0
UNSC_2014_SPV.7138_spch009_China_00.txt,China always respects the sovereignty and territorial integrity of all States .  ,_,_,0,0,0,"[('integrity', 'positive'), ('respects', 'positive')]",0.18181818181818182,0
UNSC_2014_SPV.7138_spch009_China_00.txt,Those are long - standing and fundamental elements of China 's foreign policy .  ,_,_,0,0,0,[],0.0,0
UNSC_2014_SPV.7138_spch009_China_00.txt,"At the same time , we note that foreign interference is also a significant factor ,  giving rise to violent clashes on the streets of Ukraine  and resulting in the crisis in the country .  ",Direct_NegEval,_,1,0,1,"[('clash', 'negative'), ('crisi', 'negative'), ('interfer', 'negative'), ('violent', 'negative'), ('significant', 'positive')]",-0.09375,1
UNSC_2014_SPV.7138_spch009_China_00.txt,"The failure to implement the 21 February agreement has further exacerbated the turmoil in Ukraine , with serious social and economic consequences for the country .  ",Direct_NegEval,_,1,0,1,"[('exacerbat', 'negative'), ('fail', 'negative'), ('turmoil', 'negative'), ('agree', 'positive')]",-0.08333333333333333,1
UNSC_2014_SPV.7138_spch009_China_00.txt,We condemn and oppose all extreme and violent acts .,Direct_NegEval,_,1,0,1,"[('condemn', 'negative'), ('extreme', 'negative'), ('oppose', 'negative'), ('violent', 'negative')]",-0.4444444444444444,1
UNSC_2016_SPV.7658_spch029_Brazil_04_GD.txt,"At the domestic level , let me highlight  the drafting process of our national action plan on women and peace and security .  ",_,_,0,0,0,"[('peace', 'positive')]",0.047619047619047616,0
UNSC_2016_SPV.7658_spch029_Brazil_04_GD.txt,"We are striving to elaborate an effective plan  to address the four pillars of the agenda : prevention , protection , participation , and peacebuilding and recovery .  ",_,_,0,0,0,"[('effectiv', 'positive'), ('elaborat', 'positive'), ('peace', 'positive'), ('protect', 'positive'), ('recover', 'positive')]",0.21739130434782608,0
UNSC_2016_SPV.7658_spch029_Brazil_04_GD.txt,"This will include  but will not be limited  to measures to increase the percentage of female peacekeepers ;  to foster the participation of women in all peace and security processes , including in our Foreign and Defence Ministries ;  to further improve relations between troops and civilians , particularly women and girls , in peacekeeping operations ;  and to fortify humanitarian assistance and technical cooperation initiatives on gender issues in conflict and post - conflict situations .  ",_,_,0,0,0,"[('conflict', 'negative'), ('conflict', 'negative'), ('limite', 'negative'), ('assistance', 'positive'), ('civil', 'positive'), ('cooperat', 'positive'), ('foster', 'positive'), ('humanitarian', 'positive'), ('improve', 'positive'), ('peace', 'positive'), ('peace', 'positive'), ('peace', 'positive')]",0.08695652173913043,0
UNSC_2016_SPV.7658_spch029_Brazil_04_GD.txt,"Since the women and peace and security agenda is not solely a Government matter ,  we have established a broad - based working group comprising representatives not only of relevant ministries and the armed forces ,  but also of academia and civil society ,  to debate and draft our national action plan .  ",_,_,0,0,0,"[('civil', 'positive'), ('peace', 'positive'), ('relevant', 'positive')]",0.0625,0
UNSC_2016_SPV.7658_spch029_Brazil_04_GD.txt,"In conclusion , let me reiterate Brazil 's firm commitment to both the promotion of peace in Africa and the crosscutting campaign on gender equality and women 's empowerment .  ",_,_,0,0,0,"[('commitment', 'positive'), ('empower', 'positive'), ('equality', 'positive'), ('peace', 'positive')]",0.14285714285714285,0
UNSC_2016_SPV.7658_spch029_Brazil_04_GD.txt,We will continue to advance these inseparable agendas at all levels of the United Nations . ,_,_,0,0,0,"[('advanc', 'positive'), ('inseparab', 'positive')]",0.13333333333333333,0
UNSC_2014_SPV.7154_spch005_Lithuania_01_GD.txt,"Groups of provocateurs in the hundreds ,  supported by pro - Russian militias ,  are attacking buildings of Ukraine 's State institutions  and declaring independence from Ukraine ,  as well as announcing plans for new referendums on joining Russia ,  in spite of the fact that recent opinion polls clearly show  that the predominant majority of people in the region see their future inextricably linked to Ukraine .  ",Indirect_NegEval,_,1,0,1,"[('attack', 'negative'), ('spite', 'negative'), ('joining', 'positive'), ('support', 'positive'), ('well', 'positive')]",0.016129032258064516,0
UNSC_2014_SPV.7154_spch005_Lithuania_01_GD.txt,"In fact , about 65 per cent of the region 's residents ,  according to opinion polls ,  have expressed their desire to remain part of Ukraine ,  while only 18.2 per cent want to join Russia .",_,_,0,0,0,"[('desir', 'positive'), ('join', 'positive')]",0.06060606060606061,0
UNSC_2014_SPV.7138_spch008_Rwanda_01.txt,The situation in Ukraine has rapidly unfolded .  ,_,_,0,0,0,[],0.0,0
UNSC_2014_SPV.7138_spch008_Rwanda_01.txt,"We are concerned that the rhetoric of , and pressure from , many actors have blinded us from carefully analysing the situation and understanding the root causes ,  thereby preventing us from finding a suitable solution  and , in the process , de - escalating the crisis .  ",Direct_NegEval,_,1,0,1,"[('blinded', 'negative'), ('concerned', 'negative'), ('crisi', 'negative'), ('careful', 'positive'), ('suitable', 'positive'), ('understand', 'positive')]",0.0,0
UNSC_2014_SPV.7138_spch008_Rwanda_01.txt,"Why , then , did we vote in favour ?  ",_,_,0,0,0,[],0.0,0
UNSC_2014_SPV.7138_spch008_Rwanda_01.txt,"The draft resolution contains important principles  on which we all agree : respect for the independence , sovereignty and territorial integrity of countries and the need for a de - escalation of the crisis .  ",_,_,0,0,0,"[('crisi', 'negative'), ('agree', 'positive'), ('integrity', 'positive'), ('principl', 'positive'), ('resolut', 'positive'), ('respect', 'positive')]",0.12903225806451613,0
UNSC_2014_SPV.7138_spch008_Rwanda_01.txt,Most important to us is the fact that the draft text calls for a Ukrainian inclusive political dialogue .  ,_,_,0,0,0,[],0.0,0
UNSC_2014_SPV.7138_spch008_Rwanda_01.txt,We believe  that the crisis in Ukraine can be settled primarily by a more vigorous campaign  geared towards winning the hearts of all Ukrainians  and ensuring the protection of all .  ,Direct_NegEval,_,1,0,1,"[('crisi', 'negative'), ('ensur', 'positive'), ('hearts', 'positive'), ('protect', 'positive'), ('vigor', 'positive'), ('winn', 'positive')]",0.13333333333333333,0
UNSC_2014_SPV.7138_spch008_Rwanda_01.txt,"To date , we have not seen such steps .  ",Direct_NegEval,_,1,0,1,[],0.0,0
UNSC_2014_SPV.7138_spch008_Rwanda_01.txt,There has not been intercommunal dialogue .  ,Direct_NegEval,_,1,0,1,[],0.0,0
UNSC_2014_SPV.7138_spch008_Rwanda_01.txt,It is time for Ukrainians to listen to their hearts .  ,_,_,0,0,0,"[('hearts', 'positive')]",0.1,0
UNSC_2014_SPV.7138_spch008_Rwanda_01.txt,It is time to see statesmen on all sides helping their communities  to identify that silver thread that has kept them together as a united and prosperous nation for all these years .,_,_,0,0,0,"[('helping', 'positive'), ('prosper', 'positive')]",0.0625,0
UNSC_2014_SPV.7138_spch007_Lithuania_01.txt,"And yet , in defiance to the Budapest Memorandum ,  whereby the Russian Federation reaffirmed  its obligation to refrain from the threat or use of force against the territorial integrity or political independence of Ukraine ,  contrary to the Treaty on Friendship , Cooperation , and Partnership between Ukraine and the Russian Federation of 1997 ,  which affirms  that both countries agree to respect each other 's territorial integrity  and confirm the viability ofthe borders existing between them ,  and in violation of the obligations and commitments  undertaken by Russia during its accession to key regional and international organizations ,  Ukraine is about to be carved up .  ",Direct_NegEval,_,1,0,1,"[('against', 'negative'), ('contrary', 'negative'), ('defian', 'negative'), ('threat', 'negative'), ('violat', 'negative'), ('affirm', 'positive'), ('agree', 'positive'), ('commitment', 'positive'), ('confirm', 'positive'), ('cooperat', 'positive'), ('friendship', 'positive'), ('integrity', 'positive'), ('integrity', 'positive'), ('partner', 'positive'), ('reaffirm', 'positive'), ('respect', 'positive'), ('viability', 'positive')]",0.0707070707070707,0
UNSC_2014_SPV.7138_spch007_Lithuania_01.txt,"While the United Nations , the Organization for Security and Cooperation in Europe , the Council of Europe and individual world leaders have been trying hard in the past few weeks to get Russia to engage with Ukrainian authorities  in order to avoid a veritable crisis over Crimea ,  and while the Ukrainian authorities repeated their readiness  to accept international monitors and mediation efforts ,  Russian troops and equipment were being amassed in Crimea ,  accompanied by aggressive anti - Ukrainian propaganda and hurried anti - constitutional acts by the Crimean Parliament  to prepare the ground for an illegal referendum and eventual annexation of Crimea by Russia .  ",Direct_NegEval,_,1,0,1,"[('aggress', 'negative'), ('aggressiv', 'negative'), ('avoid', 'negative'), ('crisi', 'negative'), ('hard', 'negative'), ('illegal', 'negative'), ('accept', 'positive'), ('cooperat', 'positive'), ('effort', 'positive'), ('readiness', 'positive'), ('veritab', 'positive')]",-0.01,1
UNSC_2014_SPV.7138_spch007_Lithuania_01.txt,"Tomorrow a farce of a referendum will be held , in flagrant violation of the Ukraine and Crimean Constitutions and international law .",Direct_NegEval,_,1,0,1,"[('violat', 'negative')]",-0.047619047619047616,1
UNSC_2014_SPV.7219_spch015_Russian_Federation_neg_05.txt,"With regard to the Ukrainian crisis , international institutions have not risen to the occasion .  ",Direct_NegEval,_,1,0,1,"[('crisi', 'negative')]",-0.07142857142857142,1
UNSC_2014_SPV.7219_spch015_Russian_Federation_neg_05.txt,The reason lies with our Western partners .  ,_,_,0,0,0,"[('partner', 'positive')]",0.14285714285714285,0
UNSC_2014_SPV.7219_spch015_Russian_Federation_neg_05.txt,"Much has been said ,  but nothing has been done to resolve the situation .  ",Direct_NegEval,_,1,0,1,"[('resolv', 'positive')]",0.07692307692307693,0
UNSC_2014_SPV.7219_spch015_Russian_Federation_neg_05.txt,We are working hard in the OSCE .  ,_,_,0,0,0,"[('hard', 'negative')]",-0.14285714285714285,1
UNSC_2014_SPV.7219_spch015_Russian_Federation_neg_05.txt,"In the Security Council , the Russian delegation proposed three times the serious drafting of a resolution that would put an end to the violence in Ukraine .  ",_,_,0,0,0,"[('violenc', 'negative'), ('resolut', 'positive')]",0.0,0
UNSC_2014_SPV.7219_spch015_Russian_Federation_neg_05.txt,But Western colleagues responded to our proposals with blatant cynicism .  ,Direct_NegEval,_,1,0,1,"[('blatant', 'negative'), ('cynic', 'negative'), ('colleagu', 'positive')]",-0.1,1
UNSC_2014_SPV.7219_spch015_Russian_Federation_neg_05.txt,"It seems that whatever the Ukrainian Government arbitrarily does is judged favourably ,  but the victims of the geopolitical ambitions of the Ukrainian regime are actually an entire nation - the people of Ukraine .  ",_,_,0,0,0,"[('arbitrar', 'negative'), ('victim', 'negative'), ('favourab', 'positive')]",-0.03125,1
UNSC_2014_SPV.7219_spch015_Russian_Federation_neg_05.txt,The punitive operation in eastern Ukraine must be stopped immediately .  ,_,_,0,0,0,"[('punitive', 'negative')]",-0.1,1
UNSC_2014_SPV.7219_spch015_Russian_Federation_neg_05.txt,"Negotiating a resolution to the crisis is still possible ,  but the right choice must be made .",_,_,0,0,0,"[('crisi', 'negative'), ('resolut', 'positive'), ('right', 'positive')]",0.0625,0
UNSC_2014_SPV.7165_spch007_Argentina_01.txt,"Today , however , we must urge the parties   to return to a constructive dialogue .   ",_,_,0,0,0,"[('constructiv', 'positive')]",0.07692307692307693,0
UNSC_2014_SPV.7165_spch007_Argentina_01.txt,The difficult situation facing Ukraine can not be resolved through unilateral actions of any sort .   ,_,_,0,0,0,"[('difficult', 'negative'), ('resolv', 'positive')]",0.0,0
UNSC_2014_SPV.7165_spch007_Argentina_01.txt,"It is essential that we strictly abide by the principles of the Charter of the United Nations   and not intervene in matters under the domestic jurisdiction of States in any way , including military , political and economic .   ",_,_,0,0,0,"[('strict', 'negative'), ('essential', 'positive'), ('principl', 'positive')]",0.027777777777777776,0
UNSC_2014_SPV.7165_spch007_Argentina_01.txt,"We have already said that ,   and we have not come here to repeat things .   ",_,_,0,0,0,[],0.0,0
UNSC_2014_SPV.7165_spch007_Argentina_01.txt,We have come to say   that it is understandable that the Council is meeting today .   ,_,_,0,0,0,"[('understand', 'positive')]",0.06666666666666667,0
UNSC_2014_SPV.7165_spch007_Argentina_01.txt,"The other reason we are here is to reject violence involving two concrete events , namely , the attack against the Mayor of Kharkiv , in eastern Ukraine ,   and ,   as requested by the Secretary - General ,   Argentina calls   for the immediate and unconditional release of the military observers of the Organization for Security and Cooperation in Europe   who are being held hostage .   ",_,_,0,0,0,"[('against', 'negative'), ('attack', 'negative'), ('hostage', 'negative'), ('reject', 'negative'), ('violenc', 'negative'), ('cooperat', 'positive')]",-0.06896551724137931,1
UNSC_2014_SPV.7165_spch007_Argentina_01.txt,Again we reiterate   that the Council meets in order to promote peace .   ,_,_,0,0,0,"[('peace', 'positive')]",0.08333333333333333,0
UNSC_2014_SPV.7165_spch007_Argentina_01.txt,"With a pen in hand and with our good faith , we stand ready to help Ukraine emerge from this difficult situation   so that it can achieve the peace that its people deserve .",_,_,0,0,0,"[('difficult', 'negative'), ('achiev', 'positive'), ('deserv', 'positive'), ('faith', 'positive'), ('good', 'positive'), ('help', 'positive'), ('peace', 'positive'), ('ready', 'positive')]",0.1875,0
UNSC_2016_SPV.7643_spch010_United_States_Of_America_00_GD.txt,"On behalf of the United States , I should like sincerely to thank those countries  that voted in favour of resolution 2272 ( 2016 ) ,  which was adopted today .  ",_,_,0,0,0,"[('adopt', 'positive'), ('behalf', 'positive'), ('like', 'positive'), ('resolut', 'positive'), ('sincer', 'positive'), ('thank', 'positive')]",0.23076923076923078,0
UNSC_2016_SPV.7643_spch010_United_States_Of_America_00_GD.txt,"The resolution underscores  the Security Council 's responsibility  - our responsibility -  to address the scourge of sexual exploitation and abuse in United Nations peacekeeping ,  which has been allowed to persist for far too long .  ",Direct_NegEval,_,1,0,1,"[('abus', 'negative'), ('exploit', 'negative'), ('scourg', 'negative'), ('too', 'negative'), ('allowed', 'positive'), ('peace', 'positive'), ('resolut', 'positive'), ('responsib', 'positive'), ('responsib', 'positive')]",0.030303030303030304,0
UNSC_2016_SPV.7643_spch010_United_States_Of_America_00_GD.txt,Impunity for such abuses clearly undermines our efforts to promote international peace and security .  ,Direct_NegEval,_,1,0,1,"[('abus', 'negative'), ('undermin', 'negative'), ('effort', 'positive'), ('impunity', 'positive'), ('peace', 'positive')]",0.07142857142857142,0
UNSC_2016_SPV.7643_spch010_United_States_Of_America_00_GD.txt,"The resolution makes clear  that it is our job to ensure that there is accountability  when men , women and children are abused by the Blue Helmets whom the Council has sent to protect them .   ",_,_,0,0,0,"[('abus', 'negative'), ('accountab', 'positive'), ('ensur', 'positive'), ('protect', 'positive'), ('resolut', 'positive')]",0.08823529411764706,0
UNSC_2016_SPV.7643_spch010_United_States_Of_America_00_GD.txt,"The resolution signals the Security Council 's strong support  for the zero - tolerance policy of the United Nations  and for the ongoing efforts by the Secretary - General to strengthen this institution 's response , reporting and remedial measures  to prevent and combat sexual exploitation and abuse among United Nations peacekeepers .  ",_,_,0,0,0,"[('abus', 'negative'), ('combat', 'negative'), ('exploit', 'negative'), ('effort', 'positive'), ('peace', 'positive'), ('resolut', 'positive'), ('strength', 'positive'), ('strong', 'positive'), ('support', 'positive'), ('tolera', 'positive')]",0.08163265306122448,0
UNSC_2016_SPV.7643_spch010_United_States_Of_America_00_GD.txt,"The resolution underscores the fact  that peacekeepers found guilty  - not those accused ,  those found guilty -  of committing sexual exploitation and abuse  do not deserve to serve in United Nations peacekeeping missions ,  and sends a clear message to troop- and police - contributing countries that fail to take action to prevent or punish credible allegations of sexual abuse and exploitation ,  as well as to all States Members of the United Nations and to United Nations bodies ,  to ensure that these investigations are carried out thoroughly , promptly and impartially .",_,_,0,0,0,"[('abus', 'negative'), ('abus', 'negative'), ('accuse', 'negative'), ('allegation', 'negative'), ('exploit', 'negative'), ('exploit', 'negative'), ('fail', 'negative'), ('guilty', 'negative'), ('guilty', 'negative'), ('punish', 'negative'), ('credible', 'positive'), ('deserv', 'positive'), ('ensur', 'positive'), ('impartial', 'positive'), ('peace', 'positive'), ('peace', 'positive'), ('promptly', 'positive'), ('resolut', 'positive'), ('well', 'positive')]",-0.011627906976744186,1
UNSC_2016_SPV.7658_spch017_New_Zealand_00_GD.txt,"I should like to take this opportunity to thank Angola for organizing this important debate , and Minister Delgado for presiding over it .  ",_,_,0,0,0,"[('like', 'positive'), ('opportunity', 'positive'), ('thank', 'positive')]",0.13636363636363635,0
UNSC_2016_SPV.7658_spch017_New_Zealand_00_GD.txt,We also thank the briefers for their insights .  ,_,_,0,0,0,"[('thank', 'positive')]",0.125,0
UNSC_2016_SPV.7658_spch017_New_Zealand_00_GD.txt,We have made significant progress in the 15 years since the Security Council adopted its landmark resolution 1325 ( 2000 ) on women and peace and security .  ,_,_,0,0,0,"[('adopt', 'positive'), ('peace', 'positive'), ('progress', 'positive'), ('resolut', 'positive'), ('significant', 'positive')]",0.2,0
UNSC_2016_SPV.7658_spch017_New_Zealand_00_GD.txt,The fundamental importance of addressing the impact of conflict on women and girls is now widely acknowledged .  ,_,_,0,0,0,"[('conflict', 'negative')]",-0.058823529411764705,1
UNSC_2016_SPV.7658_spch017_New_Zealand_00_GD.txt,We have agreed frameworks in place .  ,_,_,0,0,0,"[('agree', 'positive')]",0.16666666666666666,0
UNSC_2016_SPV.7658_spch017_New_Zealand_00_GD.txt,"However , practical implementation lags behind , particularly with women 's participation in conflict prevention and resolution processes .  ",Direct_NegEval,_,1,0,1,"[('conflict', 'negative'), ('lags', 'negative'), ('practical', 'positive'), ('resolut', 'positive')]",0.0,0
UNSC_2016_SPV.7658_spch017_New_Zealand_00_GD.txt,Meaningful participation is the exception rather than the rule .  ,Direct_NegEval,_,1,0,1,"[('meaningful', 'positive')]",0.1111111111111111,0
UNSC_2016_SPV.7658_spch017_New_Zealand_00_GD.txt,That was evident at last week 's open debate on conflict prevention in the Great Lakes region ( see S / PV.7653 ) .  ,_,_,0,0,0,"[('conflict', 'negative'), ('great', 'positive'), ('open', 'positive')]",0.05,0
UNSC_2016_SPV.7658_spch017_New_Zealand_00_GD.txt,Empirical evidence confirms  that the meaningful participation of women during all stages of conflict resolution contributes strongly to preventing escalation and sustaining peace .  ,_,Correction,0,1,1,"[('conflict', 'negative'), ('confirm', 'positive'), ('meaningful', 'positive'), ('peace', 'positive'), ('resolut', 'positive'), ('sustain', 'positive')]",0.17391304347826086,0
