file_id,sentence_text,A0,B1,NE_score_binary,C_score_binary,ALL_score_binary,lexicoder_words_polarity,lexicoder_score,lexicoder_score_binary
UNSC_2014_SPV.7138_spch012_Australia_00.txt,"As the body mandated under the United Nations Charter with the primary responsibility for the maintenance of international peace and security ,  the Security Council has a primordial responsibility to uphold those obligations .  ",_,_,0,0,0,"[('peace', 'positive'), ('responsib', 'positive'), ('responsib', 'positive'), ('uphold', 'positive')]",0.125,0
UNSC_2014_SPV.7138_spch012_Australia_00.txt,"As Council members , we do so on behalf of all Member States .  ",_,_,0,0,0,"[('behalf', 'positive')]",0.08333333333333333,0
UNSC_2014_SPV.7138_spch012_Australia_00.txt,The draft resolution directly and carefully reflects those fundamental norms .  ,_,_,0,0,0,"[('careful', 'positive'), ('resolut', 'positive')]",0.2,0
UNSC_2014_SPV.7138_spch012_Australia_00.txt,There is nothing in it that any State Member of the United Nations could reasonably oppose .  ,_,_,0,0,0,"[('oppose', 'negative'), ('reasonab', 'positive')]",0.0,0
UNSC_2014_SPV.7138_spch012_Australia_00.txt,Russia 's decision to veto the resolution is therefore profoundly unsettling .  ,Direct_NegEval,_,1,0,1,"[('unsettl', 'negative'), ('resolut', 'positive')]",0.0,0
UNSC_2014_SPV.7138_spch012_Australia_00.txt,The referendum to be held tomorrow in Crimea is dangerous and destabilizing .  ,Indirect_NegEval,_,1,0,1,"[('danger', 'negative')]",-0.08333333333333333,1
UNSC_2014_SPV.7138_spch012_Australia_00.txt,It is unauthorized and invalid .  ,Indirect_NegEval,_,1,0,1,"[('invalid', 'negative')]",-0.2,1
UNSC_2014_SPV.7138_spch012_Australia_00.txt,The international community will not recognize the result  nor any action taking on the basis of it .,_,_,0,0,0,[],0.0,0
UNSC_2016_SPV.7643_spch007_Russian_Federation_02_GD.txt,We would like to underscore  that we are concerned by the fact  that the sponsors of the resolution ignored the logical and wise amendments that were proposed by Egypt and were backed by troop - contributing countries ( TCCs ) .  ,Indirect_NegEval,_,1,0,1,"[('concerned', 'negative'), ('ignor', 'negative'), ('like', 'positive'), ('resolut', 'positive'), ('wise', 'positive')]",0.02702702702702703,0
UNSC_2016_SPV.7643_spch007_Russian_Federation_02_GD.txt,This is a case in which the view of the troop - contributing countries must be heard  and must be included in the work on Security Council resolutions .  ,_,_,0,0,0,"[('resolut', 'positive')]",0.037037037037037035,0
UNSC_2016_SPV.7643_spch007_Russian_Federation_02_GD.txt,"We believe  it is wrong to pit the Council up against the General Assembly and , even worse , against TCCs .",Direct_NegEval,_,1,0,1,"[('against', 'negative'), ('against', 'negative'), ('worse', 'negative'), ('wrong', 'negative')]",-0.21052631578947367,1
UNSC_2014_SPV.7138_spch014_Nigeria_01.txt,Nigeria is vehemently opposed  to unilateral secession or forceful excision of territory  designed to alter the configuration of States in their internationally recognized boundaries .  ,Indirect_NegEval,_,1,0,1,"[('oppose', 'negative'), ('opposed', 'negative'), ('secession', 'negative'), ('forceful', 'positive')]",-0.08333333333333333,1
UNSC_2014_SPV.7138_spch014_Nigeria_01.txt,"Standing on that fundamental principle ,  Nigeria is opposed  to any unilateral declaration by a component part of a State  that will alter the configuration of the State  to which it appropriately belongs .  ",Indirect_NegEval,_,1,0,1,"[('oppose', 'negative'), ('opposed', 'negative'), ('principl', 'positive')]",-0.03125,1
UNSC_2014_SPV.7138_spch014_Nigeria_01.txt,It is therefore needless to restate that the impending referendum in Crimea is not in consonance with the Constitution of Ukraine .  ,Indirect_NegEval,_,1,0,1,[],0.0,0
UNSC_2014_SPV.7138_spch014_Nigeria_01.txt,The consequences of any defiance are better imagined than described .,_,_,0,0,0,"[('defian', 'negative'), ('better', 'positive')]",0.0,0
UNSC_2016_SPV.7643_spch005_Egypt_00_GD.txt,"At the outset , I would like to express  my unequivocal condemnation of all crimes of sexual exploitation and abuse  and to emphasize  that States must take all the measures necessary to combat and eradicate such crimes as a deterrent to potential offenders .  ",_,_,0,0,0,"[('abus', 'negative'), ('combat', 'negative'), ('condemn', 'negative'), ('crimes', 'negative'), ('crimes', 'negative'), ('deterrent', 'negative'), ('eradicat', 'negative'), ('exploit', 'negative'), ('offend', 'negative'), ('like', 'positive')]",-0.19047619047619047,1
UNSC_2016_SPV.7643_spch005_Egypt_00_GD.txt,"I would also like to stress  how important it is that every effort be made  to assist the victims of such crimes ,  in line with the compliance of Egypt and every other State Member of the United Nations with our zero - tolerance policy .  ",_,_,0,0,0,"[('crimes', 'negative'), ('stress', 'negative'), ('victim', 'negative'), ('assist', 'positive'), ('complianc', 'positive'), ('effort', 'positive'), ('like', 'positive'), ('tolera', 'positive')]",0.046511627906976744,0
UNSC_2016_SPV.7643_spch005_Egypt_00_GD.txt,"The Egyptian delegation chose not to vote against today 's resolution 2272 ( 2016 )  out of our sincere belief in the importance of many of its provisions ,  which are designed to deal with repeated cases of sexual exploitation and abuse in peacekeeping operations .  ",_,_,0,0,0,"[('abus', 'negative'), ('against', 'negative'), ('exploit', 'negative'), ('peace', 'positive'), ('resolut', 'positive'), ('sincer', 'positive')]",0.0,0
UNSC_2016_SPV.7643_spch005_Egypt_00_GD.txt,"Despite the unilateral approach to the negotiations on the draft resolution ,  we have chosen not to vote against it .  ",_,_,0,0,0,"[('against', 'negative'), ('resolut', 'positive')]",0.0,0
UNSC_2016_SPV.7643_spch005_Egypt_00_GD.txt,"Throughout the negotiations and during yesterday 's briefing on the subject ( see S / PV.7642 ) ,  my delegation has consistently pointed to the need  to differentiate between , on the one hand , condemning and combating sexual exploitation and abuse  and , on the other , tarring entire States and the troops they contribute with the same brush .  ",_,_,0,0,0,"[('abus', 'negative'), ('condemn', 'negative'), ('exploit', 'negative'), ('combating', 'positive')]",-0.038461538461538464,1
UNSC_2016_SPV.7643_spch005_Egypt_00_GD.txt,The way that peacekeeping troops and troop - contributing countries ( TCCs ) have been libelled is completely unacceptable .  ,Direct_NegEval,_,1,0,1,"[('unacceptab', 'negative'), ('peace', 'positive')]",0.0,0
UNSC_2016_SPV.7643_spch005_Egypt_00_GD.txt,It has a drastic and negative effect on the troops ' morale  and demonstrates contempt for the sacrifices of tens of thousands of peacekeeping personnel operating under extremely difficult conditions .   ,Direct_NegEval,_,1,0,1,"[('contempt', 'negative'), ('difficult', 'negative'), ('negativ', 'negative'), ('morale', 'positive'), ('peace', 'positive')]",-0.034482758620689655,1
UNSC_2016_SPV.7643_spch005_Egypt_01_GD.txt,"The Security Council has chosen to act on an issue outside its purview ,  since conduct and discipline ,  including in relation to sexual exploitation and abuse ,  are matters that are at the very core of the competence of the General Assembly .  ",Direct_NegEval,_,1,0,1,"[('abus', 'negative'), ('exploit', 'negative'), ('competen', 'positive')]",-0.025,1
UNSC_2016_SPV.7643_spch005_Egypt_01_GD.txt,"All States Members of the United Nations are represented in the General Assembly ,  including the TCCs .  ",_,_,0,0,0,[],0.0,0
UNSC_2016_SPV.7643_spch005_Egypt_01_GD.txt,"Therefore , taking action on this matter in the Security Council rather than in the General Assembly illustrates ulterior motives  aimed at capitalizing on the fact the major troop - contributing countries are absent from this organ ,  in order to adopt a resolution that never would have been adopted in the organ  designated with responsibility to confront sexual abuse and exploitation .  ",Direct_NegEval,_,1,0,1,"[('absent', 'negative'), ('abus', 'negative'), ('confront', 'negative'), ('exploit', 'negative'), ('adopt', 'positive'), ('adopt', 'positive'), ('resolut', 'positive'), ('responsib', 'positive')]",0.0,0
UNSC_2016_SPV.7643_spch005_Egypt_01_GD.txt,"It would have been more appropriate  if United Nations bodies had focused on addressing the root causes of the problem  by providing sufficient predeployment training to peacekeeping forces ,  ensuring the separation of United Nations camps from the local population ,  avoiding prolonged rotation  and providing adequate living conditions , among other things . ",_,_,0,0,0,"[('avoid', 'negative'), ('problem', 'negative'), ('adequat', 'positive'), ('ensur', 'positive'), ('peace', 'positive'), ('providing', 'positive'), ('providing', 'positive'), ('suffic', 'positive')]",0.08,0
UNSC_2014_SPV.7219_spch007_Lithuania_neg_00.txt,We are deeply shocked  by yesterday 's downing of a Malaysia Airlines Boeing 777 in eastern Ukraine .  ,_,_,0,0,0,"[('shocked', 'negative')]",-0.058823529411764705,1
UNSC_2014_SPV.7219_spch007_Lithuania_neg_00.txt,"We express our sincere condolences  to Malaysia , the Netherlands , Australia , Indonesia , the United Kingdom , Germany , Belgium , the Philippines , Canada and the other nations whose citizens were among the 298 people who perished .  ",_,_,0,0,0,"[('perish', 'negative'), ('sincer', 'positive')]",0.0,0
UNSC_2014_SPV.7219_spch007_Lithuania_neg_00.txt,Our deepest sympathies go to the families of the victims .  ,_,_,0,0,0,"[('victim', 'negative'), ('sympathi', 'positive')]",0.0,0
UNSC_2014_SPV.7219_spch007_Lithuania_neg_00.txt,"The circumstances ofthe downing mustbe established by an independent , international investigaton ,  in accordance with international civil aviation guidelines .  ",_,_,0,0,0,"[('accordan', 'positive'), ('civil', 'positive')]",0.1111111111111111,0
UNSC_2014_SPV.7219_spch007_Lithuania_neg_00.txt,The perpetrators can not escape responsibility .  ,_,_,0,0,0,"[('escap', 'positive'), ('responsib', 'positive')]",0.3333333333333333,0
UNSC_2014_SPV.7219_spch007_Lithuania_neg_00.txt,Investigators must immediately be granted access to the crash site  and the black boxes must be handed over to independent authorities  in order to prevent the evidence being tampered with .  ,_,_,0,0,0,"[('tamper', 'negative')]",-0.03333333333333333,1
UNSC_2014_SPV.7219_spch007_Lithuania_neg_00.txt,The debris of the Malaysian plane lies in an area controlled by pro - Russian separatists .  ,_,_,0,0,0,[],0.0,0
UNSC_2014_SPV.7219_spch007_Lithuania_neg_00.txt,"This week alone , a Ukrainian AN-26 cargo plane and an Su-25 fighter jet were shot down by pro - Russian separatists from a high altitude .  ",_,_,0,0,0,"[('fight', 'negative')]",-0.041666666666666664,1
UNSC_2014_SPV.7219_spch007_Lithuania_neg_00.txt,The third  - a Malaysian passenger plane -  was deliberately shot down .  ,_,_,0,0,0,[],0.0,0
UNSC_2014_SPV.7219_spch007_Lithuania_neg_00.txt,An Il-76 transport plane and half a dozen helicopters were brought down by pro - Russian separatists at Luhansk airport and elsewhere .  ,_,_,0,0,0,[],0.0,0
UNSC_2014_SPV.7219_spch007_Lithuania_neg_00.txt,"In June , separatists boasted of possessing an SA-11 Buk missile system .  ",Indirect_NegEval,_,1,0,1,"[('boast', 'negative')]",-0.09090909090909091,1
UNSC_2014_SPV.7219_spch007_Lithuania_neg_00.txt,They claimed  to have used the system  to shoot down the An-26 cargo plane at high altitude .  ,_,_,0,0,0,[],0.0,0
UNSC_2014_SPV.7219_spch007_Lithuania_neg_00.txt,Separatist commander Igor Strelkov claimed to the media  to have shot down another aircraft at the same time as the Malaysian Airlines flight was overflying the area .,_,_,0,0,0,[],0.0,0
UNSC_2016_SPV.7643_spch003_United_States_Of_America_02_GD.txt,"Withthe proposedEgyptian amendment , there would be no cost either for non - response or for uninvestigated , unaccountable criminal behaviour .  ",Indirect_NegEval,_,1,0,1,"[('criminal', 'negative'), ('unaccount', 'negative')]",-0.1111111111111111,1
UNSC_2016_SPV.7643_spch003_United_States_Of_America_02_GD.txt,"That undermines the purpose of today 's draft resolution ,  which is to get countries to respond to credible allegations against their personnel  and to change a system that is not working .  ",Indirect_NegEval,_,1,0,1,"[('against', 'negative'), ('allegation', 'negative'), ('undermin', 'negative'), ('credible', 'positive'), ('resolut', 'positive')]",-0.03225806451612903,1
UNSC_2016_SPV.7643_spch003_United_States_Of_America_02_GD.txt,"It is to move away from talking about zero tolerance  to actually having a provision that puts in place consequences that incentivize the kinds of actions  that every member of the Security Council ,  including Egypt ,  has said it supports .  ",_,_,0,0,0,"[('support', 'positive'), ('tolera', 'positive')]",0.05128205128205128,0
UNSC_2016_SPV.7643_spch003_United_States_Of_America_02_GD.txt,"For that reason , we will vote against the proposed Egyptian amendment .  ",_,_,0,0,0,"[('against', 'negative')]",-0.09090909090909091,1
UNSC_2016_SPV.7643_spch003_United_States_Of_America_02_GD.txt,"As a Council , we often demand  that perpetrators be held accountable ,  and no one has said before that the Council is acting in contravention of the presumption of innocence .  ",_,_,0,0,0,"[('contraven', 'negative'), ('accountab', 'positive'), ('innocen', 'positive')]",0.034482758620689655,0
UNSC_2016_SPV.7643_spch003_United_States_Of_America_02_GD.txt,That is not what we are doing .  ,_,_,0,0,0,[],0.0,0
UNSC_2016_SPV.7643_spch003_United_States_Of_America_02_GD.txt,"In that regard , again , Member States will have the authority within their own systems  to determine how to pursue an investigation ,  whether a guilty finding is appropriate  and what will be the means of accountability that they put in place .  ",_,_,0,0,0,"[('guilty', 'negative'), ('accountab', 'positive'), ('determin', 'positive')]",0.025,0
UNSC_2016_SPV.7643_spch003_United_States_Of_America_02_GD.txt,But it can not be the case that simply sending a note to the Secretary - General  after allegations of such gravity are brought  is enough to dispense with a State 's obligations under the draft resolution .,Indirect_NegEval,_,1,0,1,"[('allegation', 'negative'), ('resolut', 'positive')]",0.0,0
UNSC_2014_SPV.7154_spch004_Russian_Federation_01_GD.txt,What is the situation today ?  ,_,_,0,0,0,[],0.0,0
UNSC_2014_SPV.7154_spch004_Russian_Federation_01_GD.txt,We have been told that restraint will be exercised  and a peaceful solution found to the situation that takes into account the opinions of the various groupings of the Ukrainian population .  ,_,Challenge,0,1,1,"[('peace', 'positive')]",0.03225806451612903,0
UNSC_2014_SPV.7154_spch004_Russian_Federation_01_GD.txt,That has been confirmed by our Western interlocutors .  ,_,Challenge,0,1,1,"[('confirm', 'positive')]",0.125,0
UNSC_2014_SPV.7154_spch004_Russian_Federation_01_GD.txt,"However , on 13 April the Verkhovna Rada - appointed President Turchynov stated  that the Ukrainian Security Council had decided to launch a full - scale anti - terrorist operation , including the use of the armed forces .  ",_,Correction,0,1,1,"[('terror', 'negative')]",-0.030303030303030304,1
UNSC_2014_SPV.7154_spch004_Russian_Federation_01_GD.txt,"However ,  unlike the Maidan demonstrators ,  the protesters have terrorized no one ,  have used no bulldozers against the authorioties ,  and thrown no Molotov cocktails .  ",Indirect_NegEval,_,1,0,1,"[('against', 'negative'), ('bulldoz', 'negative'), ('protest', 'negative'), ('terror', 'negative')]",-0.17391304347826086,1
UNSC_2014_SPV.7154_spch004_Russian_Federation_01_GD.txt,It is no coincidence that law - enforcement officers were present among the Maidan protestors .  ,_,_,0,0,0,"[('protest', 'negative')]",-0.07142857142857142,1
UNSC_2014_SPV.7154_spch004_Russian_Federation_01_GD.txt,Now the Kyiv authorities must use force to suppress other areas of the country .  ,_,_,0,0,0,"[('suppress', 'negative')]",-0.07142857142857142,1
UNSC_2014_SPV.7154_spch004_Russian_Federation_01_GD.txt,"According to Turchynov ,  the people of south - eastern Ukraine must end their protests by the morning of Monday , 14 April , lest armed force be used .  ",_,_,0,0,0,"[('protest', 'negative')]",-0.04,1
UNSC_2014_SPV.7154_spch004_Russian_Federation_01_GD.txt,"However , the protesters ' interests and opinions have not been taken into account or even discussed .  ",Direct_NegEval,_,1,0,1,"[('protest', 'negative')]",-0.06666666666666667,1
UNSC_2014_SPV.7154_spch004_Russian_Federation_01_GD.txt,"As a result , blood has already been shed in the South - East  and the situation is extremely dangerous .  ",Direct_NegEval,_,1,0,1,"[('blood', 'negative'), ('danger', 'negative')]",-0.1111111111111111,1
UNSC_2014_SPV.7154_spch004_Russian_Federation_01_GD.txt,Any further escalation of the situation must be swiftly stopped .,_,_,0,0,0,[],0.0,0
UNSC_2016_SPV.7658_spch026_Egypt_00_GD.txt,I would like to welcome  Ms. Maria Filomena Lobao Telo Delgado  and to thank  Angola for having convened this extremely important debate on women and peace and security in Africa .  ,_,_,0,0,0,"[('like', 'positive'), ('peace', 'positive'), ('thank', 'positive'), ('welcom', 'positive')]",0.13333333333333333,0
UNSC_2016_SPV.7658_spch026_Egypt_00_GD.txt,"I would also like to thank  the Assistant Secretary - General , the Executive Director of UN - Women , the Chair of the Peacebuilding Commission , the Observer of the African Union and the Executive Director of South Sudan",_,_,0,0,0,"[('like', 'positive'), ('peace', 'positive'), ('thank', 'positive')]",0.08571428571428572,0
UNSC_2016_SPV.7658_spch026_Egypt_00_GD.txt,Women 's Empowerment Network .  ,_,_,0,0,0,"[('empower', 'positive')]",0.25,0
UNSC_2016_SPV.7658_spch026_Egypt_00_GD.txt,"Over the past 15 years , the Security Council has managed to build a legal framework for the programme of action for women and peace and security  through the adoption of resolution 1325 ( 2000 ) and seven subsequent resolutions .  ",_,_,0,0,0,"[('adopt', 'positive'), ('peace', 'positive'), ('resolut', 'positive'), ('resolut', 'positive')]",0.10810810810810811,0
UNSC_2016_SPV.7658_spch026_Egypt_00_GD.txt,The Council accordingly established a concrete political momentum  thanks to which the contribution of women to the prevention and resolution of conflicts in Africa has significantly grown .  ,_,_,0,0,0,"[('conflict', 'negative'), ('contribution', 'positive'), ('resolut', 'positive'), ('thanks', 'positive')]",0.07407407407407407,0
UNSC_2016_SPV.7658_spch026_Egypt_00_GD.txt,That momentum has also helped reinforce the contribution of women  through a number of mechanisms and legal frameworks that have been adopted in Africa  in order to boost the participation of women in this area .  ,_,_,0,0,0,"[('adopt', 'positive'), ('contribution', 'positive'), ('helped', 'positive'), ('reinforc', 'positive')]",0.11428571428571428,0
UNSC_2016_SPV.7658_spch026_Egypt_00_GD.txt,"As examples , I may point  to the Solemn Declaration on Gender Equality in Africa  and the appointment of an African Union Special Envoy on Women , peace and security .  ",_,_,0,0,0,"[('equality', 'positive'), ('peace', 'positive'), ('solemn', 'positive'), ('special', 'positive')]",0.14285714285714285,0
UNSC_2016_SPV.7658_spch026_Egypt_00_GD.txt,And in West Africa there have been numerous positive experiences . ,_,_,0,0,0,"[('positiv', 'positive')]",0.1,0
UNSC_2014_SPV.7138_spch016_Jordan_00.txt,"Jordan has voted in favour ofthe draft resolution contained in document S/2014/189  out of its respect for Ukraine 's sovereignty , territorial integrity and political independence and non - interference in its internal affairs .  ",_,_,0,0,0,"[('interfer', 'negative'), ('integrity', 'positive'), ('resolut', 'positive'), ('respect', 'positive')]",0.0625,0
UNSC_2014_SPV.7138_spch016_Jordan_00.txt,"Moreover , it calls  for adherence to the purposes and principles of the Charter of the United Nations , especially Article 1 ,  and to the use of peaceful means to settle disputes .  ",_,_,0,0,0,"[('disput', 'negative'), ('adhere', 'positive'), ('peace', 'positive'), ('principl', 'positive')]",0.06666666666666667,0
UNSC_2014_SPV.7138_spch016_Jordan_00.txt,"Jordan confirms  the importance of upholding the territorial integrity of Ukraine  and subjecting all its territories , including Crimea , to Ukrainian sovereignty , in accordance with the principles of international law and relevant international resolutions ,  including the 1994 Budapest Memorandum and the 1997 Treaty on Friendship , Cooperation and Partnership . ",_,_,0,0,0,"[('accordan', 'positive'), ('confirm', 'positive'), ('cooperat', 'positive'), ('friendship', 'positive'), ('integrity', 'positive'), ('partner', 'positive'), ('principl', 'positive'), ('relevant', 'positive'), ('resolut', 'positive'), ('uphold', 'positive')]",0.2127659574468085,0
UNSC_2014_SPV.7165_spch010_Republic_Of_Korea_00.txt,The Republic of Korea is deeply concerned   over the continuing tensions in eastern Ukraine .   ,_,_,0,0,0,"[('concerned', 'negative'), ('tension', 'negative')]",-0.14285714285714285,1
UNSC_2014_SPV.7165_spch010_Republic_Of_Korea_00.txt,"Despite the agreement reached in Geneva on 17 April ,   the situation in Ukraine is showing no signs of abating .   ",_,_,0,0,0,"[('agree', 'positive')]",0.05263157894736842,0
UNSC_2014_SPV.7165_spch010_Republic_Of_Korea_00.txt,"We are troubled   in particular by the continuing violence and aggressive provocations by illegal armed groups ,   including the seizure of key public buildings and the recent assassination attempt against the Mayor of the eastern city of Kharkiv .   ",_,_,0,0,0,"[('against', 'negative'), ('aggress', 'negative'), ('aggressiv', 'negative'), ('assassin', 'negative'), ('illegal', 'negative'), ('provocation', 'negative'), ('seiz', 'negative'), ('troubl', 'negative'), ('trouble', 'negative'), ('violenc', 'negative')]",-0.2702702702702703,1
UNSC_2014_SPV.7165_spch010_Republic_Of_Korea_00.txt,All provocative actions and hostile rhetoric aimed at destabilizing Ukraine must cease immediately .   ,_,_,0,0,0,"[('hostil', 'negative')]",-0.07692307692307693,1
UNSC_2014_SPV.7165_spch010_Republic_Of_Korea_00.txt,"As agreed in the Geneva statement ,   all illegal armed groups must be disarmed and all illegally seized key public buildings vacated .   ",_,_,0,0,0,"[('illegal', 'negative'), ('illegal', 'negative'), ('seiz', 'negative'), ('agree', 'positive')]",-0.09523809523809523,1
UNSC_2014_SPV.7165_spch010_Republic_Of_Korea_00.txt,"We strongly condemn   the detention of military monitors of the Organization for Security and Cooperation in Europe ( OSCE ) , as well as of Ukrainian staff by illegal armed groups .   ",_,_,0,0,0,"[('condemn', 'negative'), ('illegal', 'negative'), ('cooperat', 'positive'), ('well', 'positive')]",0.0,0
UNSC_2014_SPV.7165_spch010_Republic_Of_Korea_00.txt,It should be noted that the OSCE monitoring mechanism is an indispensable tool for implementing the Geneva statement .   ,_,_,0,0,0,"[('indispens', 'positive')]",0.05555555555555555,0
UNSC_2014_SPV.7165_spch010_Republic_Of_Korea_00.txt,It is unacceptable to target international observers who are working to de - escalate the volatile situation .   ,_,_,0,0,0,"[('unacceptab', 'negative'), ('volatil', 'negative')]",-0.125,1
UNSC_2014_SPV.7165_spch010_Republic_Of_Korea_00.txt,They must be released immediately and unconditionally .   ,_,_,0,0,0,[],0.0,0
UNSC_2014_SPV.7165_spch010_Republic_Of_Korea_00.txt,The safety and security of all international personnel must be fully guaranteed by all actors on the ground .   ,_,_,0,0,0,"[('safety', 'positive')]",0.05555555555555555,0
UNSC_2014_SPV.7165_spch010_Republic_Of_Korea_00.txt,"In the light of the ongoing situation in Ukraine , we reiterate that constructive dialogue among all concerned parties will be the only way to achieve a peaceful solution .   ",_,_,0,0,0,"[('concerned', 'negative'), ('achiev', 'positive'), ('constructiv', 'positive'), ('peace', 'positive')]",0.07142857142857142,0
UNSC_2014_SPV.7165_spch010_Republic_Of_Korea_00.txt,"In that regard , we call for all parties   to the Geneva statement to implement their commitments .   ",_,_,0,0,0,"[('commitment', 'positive')]",0.0625,0
UNSC_2014_SPV.7165_spch010_Republic_Of_Korea_00.txt,"As Ukraine moves towards critical elections in May ,   it is all the more important to ensure the holding of fair and free elections in the country ,   without any intervention or influence by outside forces .   ",_,_,0,0,0,"[('critic', 'negative'), ('ensur', 'positive'), ('fair', 'positive'), ('free', 'positive')]",0.058823529411764705,0
UNSC_2014_SPV.7165_spch010_Republic_Of_Korea_00.txt,We hope   that the Ukrainian Government will lead an inclusive and transparent constitutional process .,_,_,0,0,0,"[('hope', 'positive')]",0.07142857142857142,0
UNSC_2016_SPV.7643_spch015_Senegal_00_GD.txt,"I thank the United States delegation  for having taken the initiative of submitting to the Security Council the text of resolution 2272 ( 2016 ) ,  which we have just adopted ,  concerning cases of sexual exploitation and abuse committed by United Nations peacekeeping personnel and external forces authorized by the Council .  ",_,_,0,0,0,"[('abus', 'negative'), ('exploit', 'negative'), ('adopt', 'positive'), ('peace', 'positive'), ('resolut', 'positive'), ('thank', 'positive')]",0.041666666666666664,0
