file_id,sentence_text,A0,B1,NE_score_binary,C_score_binary,ALL_score_binary,lexicoder_words_polarity,lexicoder_score,lexicoder_score_binary
UNSC_2016_SPV.7658_spch015_China_02.txt," The Summit was attended by Chinese President Xi Jinping and representatives from over 140 countries , including 85 Heads of State and Government .  ",_,_,0,0,0,[],0.0,0
UNSC_2016_SPV.7658_spch015_China_02.txt,The event had a significant and far - reaching impact on the development of the global women 's cause .  ,_,_,0,0,0,"[('significant', 'positive')]",0.05555555555555555,0
UNSC_2016_SPV.7658_spch015_China_02.txt,China decided to contribute $ 10 million to the United Nations Entity for Gender Equality and the Empowerment of Women .  ,_,_,0,0,0,"[('empower', 'positive'), ('equality', 'positive')]",0.10526315789473684,0
UNSC_2016_SPV.7658_spch015_China_02.txt,"Over the next five years , China will adopt a series of initiatives  to help developing countries overcome the difficulties facing women and girls with regard to their access to medical care and education ,  strengthen training for local women  and , through a fund created in partnership with the United Nations , roll out projects dedicated to capacity - building for womin developing countries .   ",_,_,0,0,0,"[('difficult', 'negative'), ('adopt', 'positive'), ('care', 'positive'), ('created', 'positive'), ('dedicat', 'positive'), ('help', 'positive'), ('partner', 'positive'), ('strength', 'positive')]",0.1,0
UNSC_2016_SPV.7658_spch015_China_02.txt,"China attaches great importance to working with Africa ,  promoting the cause of women and  intensifying support for African women in the political , economic , cultural , educational and health domains .  ",_,_,0,0,0,"[('educational', 'positive'), ('great', 'positive'), ('support', 'positive')]",0.10714285714285714,0
UNSC_2016_SPV.7658_spch015_China_02.txt,The 2015 Johannesburg Action Plan of the Forum on China - Africa Cooperation called for intensified pragmatic cooperation between China and Africa in the area of women 's affairs and for dialogue between female leaders .  ,_,_,0,0,0,"[('cooperat', 'positive'), ('cooperat', 'positive')]",0.058823529411764705,0
UNSC_2016_SPV.7658_spch015_China_02.txt,The assistance provided by China in recent years covers almost all African countries .  ,_,_,0,0,0,"[('assistance', 'positive')]",0.07692307692307693,0
UNSC_2016_SPV.7658_spch015_China_02.txt,"China also provided women and girls in Ebola - afflicted West African countries , such as Sierra Leone and Liberia , with a large amount of assistance in kind  to support Africa 's efforts to upgrade its public - health system and emergency - response capacity on all fronts .  ",_,_,0,0,0,"[('afflict', 'negative'), ('emergency', 'negative'), ('assistance', 'positive'), ('effort', 'positive'), ('support', 'positive'), ('upgrade', 'positive')]",0.045454545454545456,0
UNSC_2016_SPV.7658_spch015_China_02.txt,"Going forward , China will implement 200 Happy Life projects across Africa and 100 village - level agricultural development projects ,  build industrial parks and vocational training centres on a collaborative basis , and provide training for 200,000 technical specialists .  ",_,_,0,0,0,"[('collaborative', 'positive'), ('forward', 'positive'), ('happy', 'positive'), ('provide', 'positive'), ('specialist', 'positive')]",0.1388888888888889,0
UNSC_2016_SPV.7658_spch015_China_02.txt,"These cooperative projects will benefit the people of Africa ,  and in particular bring new opportunities and new hope for the development of African women ,  thereby creating new conditions for conflict resolution .  ",_,_,0,0,0,"[('conflict', 'negative'), ('benefit', 'positive'), ('cooperat', 'positive'), ('creating', 'positive'), ('hope', 'positive'), ('opportunities', 'positive'), ('resolut', 'positive')]",0.16129032258064516,0
UNSC_2016_SPV.7658_spch015_China_02.txt,"China stands ready to continue working with the international community  to jointly help women achieve comprehensive development  and fully engage in political , economic and social life  so that they can contribute more positive energy to the peace , development and prosperity of the African continent and makes their own important contributions .",_,_,0,0,0,"[('achiev', 'positive'), ('comprehensiv', 'positive'), ('contribution', 'positive'), ('help', 'positive'), ('peace', 'positive'), ('positiv', 'positive'), ('prosper', 'positive'), ('ready', 'positive')]",0.16,0
UNSC_2014_SPV.7138_spch017_Luxembourg_02.txt,The referendum of 16 March is part of a vicious cycle .  ,Indirect_NegEval,_,1,0,1,"[('vicious', 'negative')]",-0.09090909090909091,1
UNSC_2014_SPV.7138_spch017_Luxembourg_02.txt,"The decision  taken on 1 March by the Council of the Russian Federation to authorize the use of the Russian armed forces on Ukrainian territory ,  and the subsequent actions undertaken ,  constitute a flagrant violation of international law .  ",Direct_NegEval,_,1,0,1,"[('violat', 'negative')]",-0.02702702702702703,1
UNSC_2014_SPV.7138_spch017_Luxembourg_02.txt,"Those actions violate the commitments Russia entered into with regard to Ukraine within the framework of the Budapest Memorandum of 1994 and the Treaty of Friendship , Cooperation and Partnership Agreement between Russia and Ukraine , signed in 1997 .  ",Direct_NegEval,_,1,0,1,"[('violat', 'negative'), ('agree', 'positive'), ('commitment', 'positive'), ('cooperat', 'positive'), ('friendship', 'positive'), ('partner', 'positive')]",0.10810810810810811,0
UNSC_2014_SPV.7138_spch017_Luxembourg_02.txt,"Had it been adopted ,  the draft resolution would have helped to put an end to that vicious cycle and the nationalist escalation that accompanies it .  ",_,_,0,0,0,"[('vicious', 'negative'), ('adopt', 'positive'), ('helped', 'positive'), ('resolut', 'positive')]",0.08,0
UNSC_2014_SPV.7138_spch017_Luxembourg_02.txt,"Today 's vote is a failure - a failure for the Security Council and the United Nations , but also , and above all , a failure for Russia .  ",Direct_NegEval,_,1,0,1,"[('fail', 'negative'), ('fail', 'negative'), ('fail', 'negative')]",-0.12,1
UNSC_2014_SPV.7138_spch017_Luxembourg_02.txt,"Would it be naive to hope that , despite that failure , we can still find a peaceful solution to the crisis  that Russia is imposing on Ukraine and the international community ?  ",_,_,0,0,0,"[('crisi', 'negative'), ('fail', 'negative'), ('naiv', 'negative'), ('hope', 'positive'), ('peace', 'positive')]",-0.03333333333333333,1
UNSC_2014_SPV.7138_spch017_Luxembourg_02.txt,"For its part , Luxembourg will not abandon that hope .  ",_,_,0,0,0,"[('abandon', 'negative'), ('hope', 'positive')]",0.0,0
UNSC_2014_SPV.7138_spch017_Luxembourg_02.txt,"Even if diplomatic efforts have not yet borne fruit ,  they must continue to achieve a solution  that respects the political independence , sovereignty , unity and territorial integrity of Ukraine , in the interest of peace , stability and prosperity in Europe .  ",_,_,0,0,0,"[('achiev', 'positive'), ('effort', 'positive'), ('integrity', 'positive'), ('peace', 'positive'), ('prosper', 'positive'), ('respects', 'positive'), ('stabili', 'positive'), ('unity', 'positive')]",0.21052631578947367,0
UNSC_2014_SPV.7138_spch017_Luxembourg_02.txt,I resume my functions as President of the Council .  ,_,_,0,0,0,[],0.0,0
UNSC_2014_SPV.7138_spch017_Luxembourg_02.txt,I give the floor to the representative of Ukraine .,_,_,0,0,0,[],0.0,0
UNSC_2014_SPV.7165_spch015_Russian_Federation_02.txt,"In Geneva , there was agreement on the need for a full rejection of extremism .   ",_,Challenge,0,1,1,"[('extremi', 'negative'), ('reject', 'negative'), ('agree', 'positive')]",-0.07142857142857142,1
UNSC_2014_SPV.7165_spch015_Russian_Federation_02.txt,"However , the Right Sector Banderists ,   instead of laying down their weapons ,   headed to the east of Ukraine .   ",_,Correction,0,1,1,"[('right', 'positive')]",0.058823529411764705,0
UNSC_2014_SPV.7165_spch015_Russian_Federation_02.txt,"As was declared , the Banderist army crossed the Dnepr .   ",_,Correction,0,1,1,[],0.0,0
UNSC_2014_SPV.7165_spch015_Russian_Federation_02.txt,Neither the Right Sector with its Nazi slogans nor any other radical organizations have laid down their arms .   ,_,Correction,0,1,1,"[('right', 'positive')]",0.05555555555555555,0
UNSC_2014_SPV.7165_spch015_Russian_Federation_02.txt,"On the contrary , those groups have become legal .   ",_,Correction,0,1,1,"[('contrary', 'negative')]",-0.125,1
UNSC_2014_SPV.7165_spch015_Russian_Federation_02.txt,They are forming military battalions with names like Dnepr and Donbass in their ranks .   ,_,_,0,0,0,"[('like', 'positive')]",0.07142857142857142,0
UNSC_2014_SPV.7165_spch015_Russian_Federation_02.txt,"How could the militias in the east be convinced to disarm or vacate buildings   if they have been surrounded ,   as has happened in Sloviansk , by subdivisions of the Ukrainian armed forces and the so - called National Guard , comprised of fighters from the Right Sector .   ",Direct_NegEval,_,1,0,1,"[('fight', 'negative'), ('convinc', 'positive'), ('right', 'positive')]",0.022727272727272728,0
UNSC_2014_SPV.7165_spch015_Russian_Federation_02.txt,"In Geneva , there was agreement that there had to be a single approach to all illicit activities in Ukraine from whichever side they might emanate   - that is , from Kyiv , the west , the east or the south .   ",_,Challenge,0,1,1,"[('illicit', 'negative'), ('agree', 'positive')]",0.0,0
UNSC_2014_SPV.7165_spch015_Russian_Federation_02.txt,"However , the Maidan remains occupied   - cement blockades are still in place -   as are several buildings in Kyiv .   ",_,Correction,0,1,1,[],0.0,0
UNSC_2014_SPV.7165_spch015_Russian_Federation_02.txt,No one has liberated anything in Kyiv .   ,_,_,0,0,0,"[('liberat', 'positive')]",0.14285714285714285,0
UNSC_2014_SPV.7165_spch015_Russian_Federation_02.txt,"In Washington , DC , they are saying , uncritically ,   that the buildings have been legally rented .   ",_,Challenge,0,1,1,[],0.0,0
UNSC_2014_SPV.7165_spch015_Russian_Federation_02.txt,But by whom ?   ,_,_,0,0,0,[],0.0,0
UNSC_2014_SPV.7165_spch015_Russian_Federation_02.txt,They have been rented by armed fighters .,_,_,0,0,0,"[('fight', 'negative')]",-0.14285714285714285,1
UNSC_2014_SPV.7138_spch018_Ukraine_00.txt,"I would like to express my sincere gratitude to the members of the Security Council for their overwhelming support of the draft resolution contained in document S/2104 / l89 ,  as well as for their support in trying to resolve the crisis by diplomatic and political means .  ",_,_,0,0,0,"[('crisi', 'negative'), ('overwhelm', 'negative'), ('gratitude', 'positive'), ('like', 'positive'), ('resolut', 'positive'), ('resolv', 'positive'), ('sincer', 'positive'), ('support', 'positive'), ('support', 'positive'), ('well', 'positive')]",0.13333333333333333,0
UNSC_2014_SPV.7138_spch018_Ukraine_00.txt,I would like to thank all the sponsors of the draft resolution for their support .  ,_,_,0,0,0,"[('like', 'positive'), ('resolut', 'positive'), ('support', 'positive'), ('thank', 'positive')]",0.26666666666666666,0
UNSC_2014_SPV.7138_spch018_Ukraine_00.txt,"In this difficult time for my country , we really need their support ,  and I want to assure them that it is highly appreciated by the people of Ukraine .  ",_,_,0,0,0,"[('difficult', 'negative'), ('apprecia', 'positive'), ('assur', 'positive'), ('support', 'positive')]",0.07142857142857142,0
UNSC_2014_SPV.7138_spch018_Ukraine_00.txt,"I would like to particularly thank the Member States who are the guarantors of the Budapest Memorandum who supported Ukraine  - the United States , the United Kingdom , France and China -  and who several times spoke in favour of territorial integrity .  ",_,_,0,0,0,"[('integrity', 'positive'), ('like', 'positive'), ('support', 'positive'), ('thank', 'positive')]",0.10256410256410256,0
UNSC_2014_SPV.7138_spch018_Ukraine_00.txt,"It is awful that the other one , the fifth guarantor , the Russian Federation , violated its own obligations .  ",Direct_NegEval,_,1,0,1,"[('awful', 'negative'), ('violat', 'negative')]",-0.11764705882352941,1
UNSC_2014_SPV.7138_spch018_Ukraine_00.txt,All the appeals by the united membership to the wisdom of the Russian leadership were not successful .  ,_,_,0,0,0,"[('successful', 'positive'), ('wisdom', 'positive'), ('not success', 'neg_positive')]",0.0,0
UNSC_2014_SPV.7138_spch018_Ukraine_00.txt,"I received a call 40 minutes ago as we were discussing the crisis in Crimea , Ukraine .  ",_,_,0,0,0,"[('crisi', 'negative')]",-0.0625,1
UNSC_2014_SPV.7138_spch018_Ukraine_00.txt,Members noticed  that somebody called me .  ,_,_,0,0,0,[],0.0,0
UNSC_2014_SPV.7138_spch018_Ukraine_00.txt,"Russian troops entered the mainland from the south , from Crimea .  ",_,_,0,0,0,[],0.0,0
UNSC_2014_SPV.7138_spch018_Ukraine_00.txt,Now we are facing a new development  and we are to face an even more dangerous stance of the Russian Federation .  ,Direct_NegEval,_,1,0,1,"[('danger', 'negative')]",-0.047619047619047616,1
UNSC_2014_SPV.7138_spch018_Ukraine_00.txt,"I appeal to all Council members to find the means and measures in the Security Council and the United Nations , as well as at the bilateral level , to do the utmost possible to stop the aggressor , the Russian delegation , present in the Chamber . ",Direct_NegEval,_,1,0,1,"[('aggress', 'negative'), ('well', 'positive')]",0.0,0
UNSC_2014_SPV.7138_spch007_Lithuania_03.txt,"The Russian Federation is challenging the very principles  on which this Organization , the United Nations , is built  and which supported the international system for the past seven decades .  ",Direct_NegEval,_,1,0,1,"[('challeng', 'negative'), ('principl', 'positive'), ('support', 'positive')]",0.03571428571428571,0
UNSC_2014_SPV.7138_spch007_Lithuania_03.txt,We deplore this veto .  ,Indirect_NegEval,_,1,0,1,"[('deplor', 'negative')]",-0.25,1
UNSC_2014_SPV.7138_spch007_Lithuania_03.txt,"The world can not allow a repetition of 1956 , 1968 or 2008 in Europe .  ",_,_,0,0,0,[],0.0,0
UNSC_2014_SPV.7138_spch007_Lithuania_03.txt,"We call on all Member States and regional and international organizations not to recognize the results of the referendum in Crimea  and not to recognize any alteration of the status of Crimea  carried out in clear and obvious violation of the Constitution of Ukraine , a United Nations founding Member .  ",_,_,0,0,0,"[('violat', 'negative')]",-0.02040816326530612,1
UNSC_2014_SPV.7138_spch007_Lithuania_03.txt,We call on Russia  to disown the illegal referendum in Crimea .  ,Indirect_NegEval,_,1,0,1,"[('illegal', 'negative')]",-0.09090909090909091,1
UNSC_2014_SPV.7138_spch007_Lithuania_03.txt,"International observers , monitors and mediators have been invited by the Ukrainian Government and must be allowed to do their job .  ",_,_,0,0,0,"[('allowed', 'positive')]",0.05,0
UNSC_2014_SPV.7138_spch007_Lithuania_03.txt,"We also urge Russia  to reaffirm its treaty obligations vis - a - vis Ukraine , including respect for its sovereignty , territorial integrity and political independence ,  and to withdraw without delay its armed forces to the areas of their permanent stations .  ",_,_,0,0,0,"[('delay', 'negative'), ('integrity', 'positive'), ('reaffirm', 'positive'), ('respect', 'positive')]",0.05263157894736842,0
UNSC_2014_SPV.7138_spch007_Lithuania_03.txt,Only political dialogue and full respect of the Charter of the United Nations and international law can put an end to the crisis and prevent further bloodshed . ,_,_,0,0,0,"[('blood', 'negative'), ('crisi', 'negative'), ('respect', 'positive')]",-0.037037037037037035,1
UNSC_2014_SPV.7219_spch006_United_States_Of_America_06.txt,Here is what we know .  ,_,_,0,0,0,[],0.0,0
UNSC_2014_SPV.7219_spch006_United_States_Of_America_06.txt,"In the past few weeks , Russia has increased the number of tanks , armoured vehicles and rocket launchers in south - west Russia .  ",_,_,0,0,0,[],0.0,0
UNSC_2014_SPV.7219_spch006_United_States_Of_America_06.txt,More advanced air defence systems have also arrived .  ,_,_,0,0,0,"[('advanc', 'positive')]",0.125,0
UNSC_2014_SPV.7219_spch006_United_States_Of_America_06.txt,"Moscow recently transferred Soviet- era tanks and artillery to the separatists , and several military vehicles crossed the border .  ",_,_,0,0,0,[],0.0,0
UNSC_2014_SPV.7219_spch006_United_States_Of_America_06.txt,"After recapturing several Ukrainian cities last weekend ,  Ukrainian officials discovered caches of weapons long associated with Russian stockpiles ,  including MANPADs , mines , grenades , meals ready to eat , vehicles and a pontoon bridge .  ",_,_,0,0,0,"[('discover', 'positive'), ('ready', 'positive')]",0.06451612903225806,0
UNSC_2014_SPV.7219_spch006_United_States_Of_America_06.txt,"Ukrainian forces have discovered large amounts of other Russian - provided military equipment ,  including accompanying documentation verifying Russian origin , in the areas they have liberated from separatists in recent days .  ",_,_,0,0,0,"[('discover', 'positive'), ('liberat', 'positive')]",0.06896551724137931,0
UNSC_2014_SPV.7219_spch006_United_States_Of_America_06.txt,"Recruiting efforts for separatist fighters are expanding inside Russia ,  and separatists have openly said  that they were looking for volunteers with experience in operating heavy weapons such as tanks and air defences .  ",_,_,0,0,0,"[('fight', 'negative'), ('heavy', 'negative'), ('effort', 'positive'), ('open', 'positive'), ('openly', 'positive')]",0.03125,0
UNSC_2014_SPV.7219_spch006_United_States_Of_America_06.txt,Russia has allowed officials from the Donetsk People 's Republic  to establish a recruiting office in Moscow .  ,_,_,0,0,0,"[('allowed', 'positive')]",0.058823529411764705,0
UNSC_2014_SPV.7219_spch006_United_States_Of_America_06.txt,"Ukrainian pilot Nadia Savchenko ,  who has long had a distinguished career in the Ukrainian military ,  was taken by separatists in mid - June .  ",_,_,0,0,0,"[('distinguished', 'positive')]",0.045454545454545456,0
UNSC_2014_SPV.7219_spch006_United_States_Of_America_06.txt,She is now being held - where ?,_,_,0,0,0,[],0.0,0
UNSC_2014_SPV.7219_spch006_United_States_Of_America_06.txt,"- in a prison in Voronezh , Russia .  ",_,_,0,0,0,"[('prison', 'negative')]",-0.16666666666666666,1
UNSC_2014_SPV.7219_spch006_United_States_Of_America_06.txt,"According to the Ukrainian Government ,  she was transferred to Russia by separatists .  ",_,_,0,0,0,[],0.0,0
UNSC_2014_SPV.7219_spch006_United_States_Of_America_06.txt,Russia continues to redeploy new forces extremely close to the Ukrainian border .  ,_,_,0,0,0,[],0.0,0
UNSC_2014_SPV.7219_spch006_United_States_Of_America_06.txt,"In addition , on Monday , a Ukrainian air force cargo plane was shot down in Ukrainian air space ,  and on Wednesday a Ukrainian fighter jet was also shot down in Ukrainian air space .  ",_,_,0,0,0,"[('fight', 'negative')]",-0.03125,1
UNSC_2014_SPV.7219_spch006_United_States_Of_America_06.txt,"In both instances ,  the Ukrainian Government believes  that the planes were fired on from Russian territory .",_,_,0,0,0,[],0.0,0
UNSC_2014_SPV.7138_spch009_China_01.txt,"The key to resolving the crisis in Ukraine is to act within the framework of law and order ,  seeking an early solution to the differences through dialogue and negotiations ,  with due respect for the legitimate rights and interests of all those in the various communities and regions .  ",_,_,0,0,0,"[('crisi', 'negative'), ('legitima', 'positive'), ('resolv', 'positive'), ('respect', 'positive'), ('rights', 'positive')]",0.06382978723404255,0
UNSC_2014_SPV.7138_spch009_China_01.txt,"All parties should move forward in the overall aim of maintaining regional peace and stability  and of protecting the fundamental interests of all the communities in Ukraine  in order to keep calm ,  exercise restraint  and prevent a further escalation of the tension ,  while resolutely seeking a political solution  so as to find a specific way out as soon as possible .  ",_,_,0,0,0,"[('tension', 'negative'), ('calm', 'positive'), ('forward', 'positive'), ('peace', 'positive'), ('protect', 'positive'), ('resolut', 'positive'), ('stabili', 'positive')]",0.08333333333333333,0
UNSC_2014_SPV.7138_spch009_China_01.txt,China has been calling  for constructive efforts and the good offices of the international community to de - escalate the situation in Ukraine .  ,_,_,0,0,0,"[('constructiv', 'positive'), ('effort', 'positive'), ('good', 'positive')]",0.13636363636363635,0
UNSC_2014_SPV.7138_spch009_China_01.txt,We note  the new developments and proposals in that regard .  ,_,_,0,0,0,[],0.0,0
UNSC_2014_SPV.7138_spch009_China_01.txt,Drafting a resolution at this juncture will only lead to confrontation  and further complicate the situation .  ,_,_,0,0,0,"[('complicat', 'negative'), ('confront', 'negative'), ('resolut', 'positive')]",-0.0625,1
UNSC_2014_SPV.7138_spch009_China_01.txt,It is not in line with the common interests ofboth the people of Ukraine and the international community .  ,_,_,0,0,0,[],0.0,0
UNSC_2014_SPV.7138_spch009_China_01.txt,"On the basis of the above , we could only abstain in the voting on the draft resolution ( S/2014/189 ) .  ",_,_,0,0,0,"[('resolut', 'positive')]",0.05555555555555555,0
UNSC_2014_SPV.7138_spch009_China_01.txt,China holds a fair and impartial position on the issue of Ukraine .  ,_,_,0,0,0,"[('fair', 'positive'), ('impartial', 'positive')]",0.16666666666666666,0
UNSC_2014_SPV.7138_spch009_China_01.txt,We will continue to mediate  and to promote dialogue  so as to play a greater contructive role in seeking a political solution to the crisis in Ukraine .  ,_,_,0,0,0,"[('crisi', 'negative')]",-0.037037037037037035,1
UNSC_2014_SPV.7138_spch009_China_01.txt,"To that end , we would like to make three proposals .",_,_,0,0,0,"[('like', 'positive')]",0.1,0
UNSC_2014_SPV.7138_spch008_Rwanda_02.txt,"In that regard , we appeal to all conflicting blocs in Ukraine to pause a little ,  close their ears to all aggravating rhetoric  and give intercommunal talks a chance .  ",_,_,0,0,0,"[('aggravat', 'negative'), ('conflict', 'negative')]",-0.07142857142857142,1
UNSC_2014_SPV.7138_spch008_Rwanda_02.txt,"If there is a need for credible mediators , the United Nations should rise to playing that role .  ",_,_,0,0,0,"[('credible', 'positive')]",0.058823529411764705,0
UNSC_2014_SPV.7138_spch008_Rwanda_02.txt,"Once again , we invite both sides to consider the mutual interests of the people of Ukraine  and to uphold their commitment to bilateral and multilateral agreements .  ",_,_,0,0,0,"[('agree', 'positive'), ('commitment', 'positive'), ('invite', 'positive'), ('uphold', 'positive')]",0.15384615384615385,0
UNSC_2014_SPV.7138_spch008_Rwanda_02.txt,"We call  on the international community to fulfil its obligation ,  to ensure no further deterioration  and to respect the principles of peace and security .  ",Direct_NegEval,_,1,0,1,"[('deteriorat', 'negative'), ('ensur', 'positive'), ('peace', 'positive'), ('principl', 'positive'), ('respect', 'positive')]",0.125,0
UNSC_2014_SPV.7138_spch008_Rwanda_02.txt,"Finally , this situation is not a win or a loss to any of us .  ",_,_,0,0,0,"[('loss', 'negative'), ('win', 'positive')]",0.0,0
UNSC_2014_SPV.7138_spch008_Rwanda_02.txt,"Also , it should not be seen as bringing dishonour to any of us .  ",_,_,0,0,0,"[('dishonour', 'negative')]",-0.07692307692307693,1
UNSC_2014_SPV.7138_spch008_Rwanda_02.txt,But let it be a lesson to us all  to truly commit and constructively work towards finding a sustainable solution to the process . ,_,_,0,0,0,"[('constructiv', 'positive'), ('sustain', 'positive')]",0.08695652173913043,0
UNSC_2014_SPV.7165_spch010_Republic_Of_Korea_01.txt,"We once again reaffirm   our full support for Ukraine 's sovereignty , independence and territorial integrity .",_,_,0,0,0,"[('integrity', 'positive'), ('reaffirm', 'positive'), ('support', 'positive')]",0.2,0
UNSC_2014_SPV.7165_spch009_China_00.txt,I wish to thank Under - Secretary - General Feltman for his briefing .   ,_,_,0,0,0,"[('thank', 'positive')]",0.09090909090909091,0
UNSC_2014_SPV.7165_spch009_China_00.txt,The crisis in Ukraine is the result of a complex fabric of historical and contemporary factors .   ,_,_,0,0,0,"[('crisi', 'negative')]",-0.0625,1
UNSC_2014_SPV.7165_spch009_China_00.txt,A political solution is the only way to end the crisis .   ,_,_,0,0,0,"[('crisi', 'negative')]",-0.09090909090909091,1
UNSC_2014_SPV.7165_spch009_China_00.txt,"To tackle the crisis at its roots ,   both the current situation and the historical facts must be considered ,   taking into account the legitimate rights , interests and demands of the various regions and ethnic communities of Ukraine   and the legitimate concerns of all the parties concerned ,   with a view to achieving a balance ofinterests for all .   ",_,_,0,0,0,"[('concerned', 'negative'), ('crisi', 'negative'), ('achiev', 'positive'), ('balance', 'positive'), ('legitima', 'positive'), ('legitima', 'positive'), ('rights', 'positive')]",0.05454545454545454,0
UNSC_2014_SPV.7165_spch009_China_00.txt,"For some time now , various parties including China , have been vigorously engaged in mediation efforts and pushing for talks   in order to ease the crisis in Ukraine .   ",_,_,0,0,0,"[('crisi', 'negative'), ('ease', 'positive'), ('effort', 'positive'), ('vigor', 'positive')]",0.07407407407407407,0
UNSC_2014_SPV.7165_spch009_China_00.txt,"The Geneva agreement reached between Russia , the United States , the European Union and Ukraine calls   for measures to de - escalate the Ukrainian situation ,   thereby sending a positive signal for a political solution to the crisis .   ",_,_,0,0,0,"[('crisi', 'negative'), ('agree', 'positive'), ('positiv', 'positive')]",0.02857142857142857,0
