file_id,EDU_text,EDU_char_offsets,EDU_token_offsets,A0,A2,A3,A4,B1,B2,B3,Binary_a0_score,Binary_b1_score,Binary_Conflict_score,Three_Conflict_labels,Direct_NegEval,Indirect_NegEval,Challenge,Correction
UNSC_2016_SPV.7658_spch015_China_02.txt,"and , through a fund created in partnership with the United Nations , roll out projects dedicated to capacity - building for womin developing countries .",627-780,105-130,_,_,_,_,_,_,_,0,0,0,_,0,0,0,0
UNSC_2016_SPV.7658_spch015_China_02.txt,"China attaches great importance to working with Africa ,",785-841,131-139,_,_,_,_,_,_,_,0,0,0,_,0,0,0,0
UNSC_2016_SPV.7658_spch015_China_02.txt,promoting the cause of women and,844-876,140-145,_,_,_,_,_,_,_,0,0,0,_,0,0,0,0
UNSC_2016_SPV.7658_spch015_China_02.txt,"intensifying support for African women in the political , economic , cultural , educational and health domains .",879-991,146-163,_,_,_,_,_,_,_,0,0,0,_,0,0,0,0
UNSC_2016_SPV.7658_spch015_China_02.txt,The 2015 Johannesburg Action Plan of the Forum on China - Africa Cooperation called for intensified pragmatic cooperation between China and Africa in the area of women 's affairs and for dialogue between female leaders .,994-1214,164-199,_,_,_,_,_,_,_,0,0,0,_,0,0,0,0
UNSC_2016_SPV.7658_spch015_China_02.txt,The assistance provided by China in recent years covers almost all African countries .,1217-1303,200-213,_,_,_,_,_,_,_,0,0,0,_,0,0,0,0
UNSC_2016_SPV.7658_spch015_China_02.txt,"China also provided women and girls in Ebola - afflicted West African countries , such as Sierra Leone and Liberia , with a large amount of assistance in kind",1306-1464,214-242,_,_,_,_,_,_,_,0,0,0,_,0,0,0,0
UNSC_2016_SPV.7658_spch015_China_02.txt,to support Africa 's efforts to upgrade its public - health system and emergency - response capacity on all fronts .,1467-1583,243-263,_,_,_,_,_,_,_,0,0,0,_,0,0,0,0
UNSC_2016_SPV.7658_spch015_China_02.txt,"Going forward , China will implement 200 Happy Life projects across Africa and 100 village - level agricultural development projects ,",1587-1721,264-284,_,_,_,_,_,_,_,0,0,0,_,0,0,0,0
UNSC_2016_SPV.7658_spch015_China_02.txt,"build industrial parks and vocational training centres on a collaborative basis ,",1724-1805,285-296,_,_,_,_,_,_,_,0,0,0,_,0,0,0,0
UNSC_2016_SPV.7658_spch015_China_02.txt,"and provide training for 200,000 technical specialists .",1807-1863,297-304,_,_,_,_,_,_,_,0,0,0,_,0,0,0,0
UNSC_2016_SPV.7658_spch015_China_02.txt,"These cooperative projects will benefit the people of Africa ,",1867-1929,305-314,_,_,_,_,_,_,_,0,0,0,_,0,0,0,0
UNSC_2016_SPV.7658_spch015_China_02.txt,"and in particular bring new opportunities and new hope for the development of African women ,",1932-2025,315-330,_,_,_,_,_,_,_,0,0,0,_,0,0,0,0
UNSC_2016_SPV.7658_spch015_China_02.txt,thereby creating new conditions for conflict resolution .,2028-2085,331-338,_,_,_,_,_,_,_,0,0,0,_,0,0,0,0
UNSC_2016_SPV.7658_spch015_China_02.txt,China stands ready to continue working with the international community,2089-2160,339-348,_,_,_,_,_,_,_,0,0,0,_,0,0,0,0
UNSC_2016_SPV.7658_spch015_China_02.txt,to jointly help women achieve comprehensive development,2163-2218,349-355,_,_,_,_,_,_,_,0,0,0,_,0,0,0,0
UNSC_2016_SPV.7658_spch015_China_02.txt,"and fully engage in political , economic and social life",2221-2277,356-365,_,_,_,_,_,_,_,0,0,0,_,0,0,0,0
UNSC_2016_SPV.7658_spch015_China_02.txt,"so that they can contribute more positive energy to the peace , development and prosperity of the African continent and makes their own important contributions .",2280-2441,366-391,_,_,_,_,_,_,_,0,0,0,_,0,0,0,0
UNSC_2014_SPV.7138_spch017_Luxembourg_02.txt,The referendum of 16 March is part of a vicious cycle .,0-55,0-11,Indirect_NegEval,Underspecified,Law_Policy,-NONE-,_,_,_,1,0,1,a0_NE,0,1,0,0
UNSC_2014_SPV.7138_spch017_Luxembourg_02.txt,The decision,58-70,12-13,Direct_NegEval,Country,-NONE-,russian_federation,_,_,_,1,0,1,a0_NE,1,0,0,0
UNSC_2014_SPV.7138_spch017_Luxembourg_02.txt,"taken on 1 March by the Council of the Russian Federation to authorize the use of the Russian armed forces on Ukrainian territory ,",73-204,14-37,Direct_NegEval,Country,-NONE-,russian_federation,_,_,_,1,0,1,a0_NE,1,0,0,0
UNSC_2014_SPV.7138_spch017_Luxembourg_02.txt,"and the subsequent actions undertaken ,",207-246,38-43,Direct_NegEval,Country,-NONE-,russian_federation,_,_,_,1,0,1,a0_NE,1,0,0,0
UNSC_2014_SPV.7138_spch017_Luxembourg_02.txt,constitute a flagrant violation of international law .,249-303,44-51,Direct_NegEval,Country,-NONE-,russian_federation,_,_,_,1,0,1,a0_NE,1,0,0,0
UNSC_2014_SPV.7138_spch017_Luxembourg_02.txt,"Those actions violate the commitments Russia entered into with regard to Ukraine within the framework of the Budapest Memorandum of 1994 and the Treaty of Friendship , Cooperation and Partnership Agreement between Russia and Ukraine , signed in 1997 .",306-557,52-91,Direct_NegEval,Country,-NONE-,russian_federation,_,_,_,1,0,1,a0_NE,1,0,0,0
UNSC_2014_SPV.7138_spch017_Luxembourg_02.txt,"Had it been adopted ,",560-581,92-96,_,_,_,_,_,_,_,0,0,0,_,0,0,0,0
UNSC_2014_SPV.7138_spch017_Luxembourg_02.txt,the draft resolution would have helped to put an end to that vicious cycle and the nationalist escalation that accompanies it .,584-711,97-118,_,_,_,_,_,_,_,0,0,0,_,0,0,0,0
UNSC_2014_SPV.7138_spch017_Luxembourg_02.txt,"Today 's vote is a failure - a failure for the Security Council and the United Nations , but also , and above all , a failure for Russia .",715-853,119-148,Direct_NegEval,Country,-NONE-,russian_federation,_,_,_,1,0,1,a0_NE,1,0,0,0
UNSC_2014_SPV.7138_spch017_Luxembourg_02.txt,"Would it be naive to hope that , despite that failure , we can still find a peaceful solution to the crisis",857-964,149-170,_,_,_,_,_,_,_,0,0,0,_,0,0,0,0
UNSC_2014_SPV.7138_spch017_Luxembourg_02.txt,that Russia is imposing on Ukraine and the international community ?,967-1035,171-181,_,_,_,_,_,_,_,0,0,0,_,0,0,0,0
UNSC_2014_SPV.7138_spch017_Luxembourg_02.txt,"For its part , Luxembourg will not abandon that hope .",1038-1092,182-192,_,_,_,_,_,_,_,0,0,0,_,0,0,0,0
UNSC_2014_SPV.7138_spch017_Luxembourg_02.txt,"Even if diplomatic efforts have not yet borne fruit ,",1095-1148,193-202,_,_,_,_,_,_,_,0,0,0,_,0,0,0,0
UNSC_2014_SPV.7138_spch017_Luxembourg_02.txt,they must continue to achieve a solution,1151-1191,203-209,_,_,_,_,_,_,_,0,0,0,_,0,0,0,0
UNSC_2014_SPV.7138_spch017_Luxembourg_02.txt,"that respects the political independence , sovereignty , unity and territorial integrity of Ukraine , in the interest of peace , stability and prosperity in Europe .",1194-1359,210-236,_,_,_,_,_,_,_,0,0,0,_,0,0,0,0
UNSC_2014_SPV.7138_spch017_Luxembourg_02.txt,I resume my functions as President of the Council .,1363-1414,237-246,_,_,_,_,_,_,_,0,0,0,_,0,0,0,0
UNSC_2014_SPV.7138_spch017_Luxembourg_02.txt,I give the floor to the representative of Ukraine .,1417-1468,247-256,_,_,_,_,_,_,_,0,0,0,_,0,0,0,0
UNSC_2014_SPV.7165_spch015_Russian_Federation_02.txt,"In Geneva , there was agreement on the need for a full rejection of extremism .",0-79,0-15,_,_,_,_,Challenge,Country,ukraine,0,1,1,b1_CC,0,0,1,0
UNSC_2014_SPV.7165_spch015_Russian_Federation_02.txt,"However , the Right Sector Banderists ,",83-122,16-22,_,_,_,_,Correction,-NONE-,-NONE-,0,1,1,b1_CC,0,0,0,1
UNSC_2014_SPV.7165_spch015_Russian_Federation_02.txt,"instead of laying down their weapons ,",126-164,23-29,_,_,_,_,Correction,-NONE-,-NONE-,0,1,1,b1_CC,0,0,0,1
UNSC_2014_SPV.7165_spch015_Russian_Federation_02.txt,headed to the east of Ukraine .,168-199,30-36,_,_,_,_,Correction,-NONE-,-NONE-,0,1,1,b1_CC,0,0,0,1
UNSC_2014_SPV.7165_spch015_Russian_Federation_02.txt,"As was declared , the Banderist army crossed the Dnepr .",203-259,37-47,_,_,_,_,Correction,-NONE-,-NONE-,0,1,1,b1_CC,0,0,0,1
UNSC_2014_SPV.7165_spch015_Russian_Federation_02.txt,Neither the Right Sector with its Nazi slogans nor any other radical organizations have laid down their arms .,263-373,48-66,_,_,_,_,Correction,-NONE-,-NONE-,0,1,1,b1_CC,0,0,0,1
UNSC_2014_SPV.7165_spch015_Russian_Federation_02.txt,"On the contrary , those groups have become legal .",377-427,67-76,_,_,_,_,Correction,-NONE-,-NONE-,0,1,1,b1_CC,0,0,0,1
UNSC_2014_SPV.7165_spch015_Russian_Federation_02.txt,They are forming military battalions with names like Dnepr and Donbass in their ranks .,431-518,77-91,_,_,_,_,_,_,_,0,0,0,_,0,0,0,0
UNSC_2014_SPV.7165_spch015_Russian_Federation_02.txt,How could the militias in the east be convinced to disarm or vacate buildings,522-599,92-105,Direct_NegEval,Country,-NONE-,ukraine,_,_,_,1,0,1,a0_NE,1,0,0,0
UNSC_2014_SPV.7165_spch015_Russian_Federation_02.txt,"if they have been surrounded ,",603-633,106-111,Direct_NegEval,Country,-NONE-,ukraine,_,_,_,1,0,1,a0_NE,1,0,0,0
UNSC_2014_SPV.7165_spch015_Russian_Federation_02.txt,"as has happened in Sloviansk , by subdivisions of the Ukrainian armed forces and the so - called National Guard , comprised of fighters from the Right Sector .",637-796,112-140,Direct_NegEval,Country,-NONE-,ukraine,_,_,_,1,0,1,a0_NE,1,0,0,0
UNSC_2014_SPV.7165_spch015_Russian_Federation_02.txt,"In Geneva , there was agreement that there had to be a single approach to all illicit activities in Ukraine from whichever side they might emanate",801-947,141-166,_,_,_,_,Challenge,Country,ukraine,0,1,1,b1_CC,0,0,1,0
UNSC_2014_SPV.7165_spch015_Russian_Federation_02.txt,"- that is , from Kyiv , the west , the east or the south .",951-1009,167-182,_,_,_,_,Challenge,Country,ukraine,0,1,1,b1_CC,0,0,1,0
UNSC_2014_SPV.7165_spch015_Russian_Federation_02.txt,"However , the Maidan remains occupied",1013-1050,183-188,_,_,_,_,Correction,-NONE-,-NONE-,0,1,1,b1_CC,0,0,0,1
UNSC_2014_SPV.7165_spch015_Russian_Federation_02.txt,- cement blockades are still in place -,1054-1093,189-196,_,_,_,_,Correction,-NONE-,-NONE-,0,1,1,b1_CC,0,0,0,1
UNSC_2014_SPV.7165_spch015_Russian_Federation_02.txt,as are several buildings in Kyiv .,1097-1131,197-203,_,_,_,_,Correction,-NONE-,-NONE-,0,1,1,b1_CC,0,0,0,1
UNSC_2014_SPV.7165_spch015_Russian_Federation_02.txt,No one has liberated anything in Kyiv .,1135-1174,204-211,_,_,_,_,_,_,_,0,0,0,_,0,0,0,0
UNSC_2014_SPV.7165_spch015_Russian_Federation_02.txt,"In Washington , DC , they are saying , uncritically ,",1178-1231,212-222,_,_,_,_,Challenge,Country,united_states_of_america,0,1,1,b1_CC,0,0,1,0
UNSC_2014_SPV.7165_spch015_Russian_Federation_02.txt,that the buildings have been legally rented .,1235-1280,223-230,_,_,_,_,Challenge,Country,united_states_of_america,0,1,1,b1_CC,0,0,1,0
UNSC_2014_SPV.7165_spch015_Russian_Federation_02.txt,But by whom ?,1284-1297,231-234,_,_,_,_,_,_,_,0,0,0,_,0,0,0,0
UNSC_2014_SPV.7165_spch015_Russian_Federation_02.txt,They have been rented by armed fighters .,1301-1342,235-242,_,_,_,_,_,_,_,0,0,0,_,0,0,0,0
UNSC_2014_SPV.7138_spch018_Ukraine_00.txt,"I would like to express my sincere gratitude to the members of the Security Council for their overwhelming support of the draft resolution contained in document S/2104 / l89 ,",0-175,0-29,_,_,_,_,_,_,_,0,0,0,_,0,0,0,0
UNSC_2014_SPV.7138_spch018_Ukraine_00.txt,as well as for their support in trying to resolve the crisis by diplomatic and political means .,178-274,30-47,_,_,_,_,_,_,_,0,0,0,_,0,0,0,0
UNSC_2014_SPV.7138_spch018_Ukraine_00.txt,I would like to thank all the sponsors of the draft resolution for their support .,278-360,48-63,_,_,_,_,_,_,_,0,0,0,_,0,0,0,0
UNSC_2014_SPV.7138_spch018_Ukraine_00.txt,"In this difficult time for my country , we really need their support ,",363-433,64-77,_,_,_,_,_,_,_,0,0,0,_,0,0,0,0
UNSC_2014_SPV.7138_spch018_Ukraine_00.txt,and I want to assure them that it is highly appreciated by the people of Ukraine .,436-518,78-94,_,_,_,_,_,_,_,0,0,0,_,0,0,0,0
UNSC_2014_SPV.7138_spch018_Ukraine_00.txt,I would like to particularly thank the Member States who are the guarantors of the Budapest Memorandum who supported Ukraine,522-646,95-114,_,_,_,_,_,_,_,0,0,0,_,0,0,0,0
UNSC_2014_SPV.7138_spch018_Ukraine_00.txt,"- the United States , the United Kingdom , France and China -",649-710,115-127,_,_,_,_,_,_,_,0,0,0,_,0,0,0,0
UNSC_2014_SPV.7138_spch018_Ukraine_00.txt,and who several times spoke in favour of territorial integrity .,713-777,128-138,_,_,_,_,_,_,_,0,0,0,_,0,0,0,0
UNSC_2014_SPV.7138_spch018_Ukraine_00.txt,"It is awful that the other one , the fifth guarantor , the Russian Federation , violated its own obligations .",780-890,139-159,Direct_NegEval,Country,-NONE-,russian_federation,_,_,_,1,0,1,a0_NE,1,0,0,0
UNSC_2014_SPV.7138_spch018_Ukraine_00.txt,All the appeals by the united membership to the wisdom of the Russian leadership were not successful .,894-996,160-177,_,_,_,_,_,_,_,0,0,0,_,0,0,0,0
UNSC_2014_SPV.7138_spch018_Ukraine_00.txt,"I received a call 40 minutes ago as we were discussing the crisis in Crimea , Ukraine .",999-1086,178-195,_,_,_,_,_,_,_,0,0,0,_,0,0,0,0
UNSC_2014_SPV.7138_spch018_Ukraine_00.txt,Members noticed,1089-1104,196-197,_,_,_,_,_,_,_,0,0,0,_,0,0,0,0
UNSC_2014_SPV.7138_spch018_Ukraine_00.txt,that somebody called me .,1107-1132,198-202,_,_,_,_,_,_,_,0,0,0,_,0,0,0,0
UNSC_2014_SPV.7138_spch018_Ukraine_00.txt,"Russian troops entered the mainland from the south , from Crimea .",1135-1201,203-214,_,_,_,_,_,_,_,0,0,0,_,0,0,0,0
UNSC_2014_SPV.7138_spch018_Ukraine_00.txt,Now we are facing a new development,1204-1239,215-221,Direct_NegEval,Country,-NONE-,russian_federation,_,_,_,1,0,1,a0_NE,1,0,0,0
UNSC_2014_SPV.7138_spch018_Ukraine_00.txt,and we are to face an even more dangerous stance of the Russian Federation .,1242-1318,222-236,Direct_NegEval,Country,-NONE-,russian_federation,_,_,_,1,0,1,a0_NE,1,0,0,0
UNSC_2014_SPV.7138_spch018_Ukraine_00.txt,"I appeal to all Council members to find the means and measures in the Security Council and the United Nations , as well as at the bilateral level , to do the utmost possible to stop the aggressor , the Russian delegation , present in the Chamber .",1322-1569,237-284,Direct_NegEval,Country,-NONE-,russian_federation,_,_,_,1,0,1,a0_NE,1,0,0,0
UNSC_2014_SPV.7138_spch007_Lithuania_03.txt,The Russian Federation is challenging the very principles,0-57,0-7,Direct_NegEval,Country,-NONE-,russian_federation,_,_,_,1,0,1,a0_NE,1,0,0,0
UNSC_2014_SPV.7138_spch007_Lithuania_03.txt,"on which this Organization , the United Nations , is built",60-118,8-18,Direct_NegEval,Country,-NONE-,russian_federation,_,_,_,1,0,1,a0_NE,1,0,0,0
UNSC_2014_SPV.7138_spch007_Lithuania_03.txt,and which supported the international system for the past seven decades .,121-194,19-30,Direct_NegEval,Country,-NONE-,russian_federation,_,_,_,1,0,1,a0_NE,1,0,0,0
UNSC_2014_SPV.7138_spch007_Lithuania_03.txt,We deplore this veto .,197-219,31-35,Indirect_NegEval,Country,Law_Policy,russian_federation,_,_,_,1,0,1,a0_NE,0,1,0,0
UNSC_2014_SPV.7138_spch007_Lithuania_03.txt,"The world can not allow a repetition of 1956 , 1968 or 2008 in Europe .",222-293,36-51,_,_,_,_,_,_,_,0,0,0,_,0,0,0,0
UNSC_2014_SPV.7138_spch007_Lithuania_03.txt,We call on all Member States and regional and international organizations not to recognize the results of the referendum in Crimea,296-426,52-72,_,_,_,_,_,_,_,0,0,0,_,0,0,0,0
UNSC_2014_SPV.7138_spch007_Lithuania_03.txt,and not to recognize any alteration of the status of Crimea,429-488,73-83,_,_,_,_,_,_,_,0,0,0,_,0,0,0,0
UNSC_2014_SPV.7138_spch007_Lithuania_03.txt,"carried out in clear and obvious violation of the Constitution of Ukraine , a United Nations founding Member .",491-601,84-102,_,_,_,_,_,_,_,0,0,0,_,0,0,0,0
UNSC_2014_SPV.7138_spch007_Lithuania_03.txt,We call on Russia,605-622,103-106,Indirect_NegEval,Country,Law_Policy,russian_federation,_,_,_,1,0,1,a0_NE,0,1,0,0
UNSC_2014_SPV.7138_spch007_Lithuania_03.txt,to disown the illegal referendum in Crimea .,625-669,107-114,Indirect_NegEval,Country,Law_Policy,russian_federation,_,_,_,1,0,1,a0_NE,0,1,0,0
UNSC_2014_SPV.7138_spch007_Lithuania_03.txt,"International observers , monitors and mediators have been invited by the Ukrainian Government and must be allowed to do their job .",672-804,115-136,_,_,_,_,_,_,_,0,0,0,_,0,0,0,0
UNSC_2014_SPV.7138_spch007_Lithuania_03.txt,We also urge Russia,807-826,137-140,_,_,_,_,_,_,_,0,0,0,_,0,0,0,0
UNSC_2014_SPV.7138_spch007_Lithuania_03.txt,"to reaffirm its treaty obligations vis - a - vis Ukraine , including respect for its sovereignty , territorial integrity and political independence ,",829-978,141-164,_,_,_,_,_,_,_,0,0,0,_,0,0,0,0
UNSC_2014_SPV.7138_spch007_Lithuania_03.txt,and to withdraw without delay its armed forces to the areas of their permanent stations .,981-1070,165-180,_,_,_,_,_,_,_,0,0,0,_,0,0,0,0
UNSC_2014_SPV.7138_spch007_Lithuania_03.txt,Only political dialogue and full respect of the Charter of the United Nations and international law can put an end to the crisis and prevent further bloodshed .,1073-1233,181-208,_,_,_,_,_,_,_,0,0,0,_,0,0,0,0
UNSC_2014_SPV.7219_spch006_United_States_Of_America_06.txt,Here is what we know .,0-22,0-5,_,_,_,_,_,_,_,0,0,0,_,0,0,0,0
UNSC_2014_SPV.7219_spch006_United_States_Of_America_06.txt,"In the past few weeks , Russia has increased the number of tanks , armoured vehicles and rocket launchers in south - west Russia .",25-155,6-30,_,_,_,_,_,_,_,0,0,0,_,0,0,0,0
UNSC_2014_SPV.7219_spch006_United_States_Of_America_06.txt,More advanced air defence systems have also arrived .,158-211,31-39,_,_,_,_,_,_,_,0,0,0,_,0,0,0,0
UNSC_2014_SPV.7219_spch006_United_States_Of_America_06.txt,"Moscow recently transferred Soviet- era tanks and artillery to the separatists , and several military vehicles crossed the border .",214-345,40-59,_,_,_,_,_,_,_,0,0,0,_,0,0,0,0
UNSC_2014_SPV.7219_spch006_United_States_Of_America_06.txt,"After recapturing several Ukrainian cities last weekend ,",348-405,60-67,_,_,_,_,_,_,_,0,0,0,_,0,0,0,0
UNSC_2014_SPV.7219_spch006_United_States_Of_America_06.txt,"Ukrainian officials discovered caches of weapons long associated with Russian stockpiles ,",408-498,68-79,_,_,_,_,_,_,_,0,0,0,_,0,0,0,0
UNSC_2014_SPV.7219_spch006_United_States_Of_America_06.txt,"including MANPADs , mines , grenades , meals ready to eat , vehicles and a pontoon bridge .",501-592,80-97,_,_,_,_,_,_,_,0,0,0,_,0,0,0,0
UNSC_2014_SPV.7219_spch006_United_States_Of_America_06.txt,"Ukrainian forces have discovered large amounts of other Russian - provided military equipment ,",595-690,98-111,_,_,_,_,_,_,_,0,0,0,_,0,0,0,0
UNSC_2014_SPV.7219_spch006_United_States_Of_America_06.txt,"including accompanying documentation verifying Russian origin , in the areas they have liberated from separatists in recent days .",693-823,112-130,_,_,_,_,_,_,_,0,0,0,_,0,0,0,0
UNSC_2014_SPV.7219_spch006_United_States_Of_America_06.txt,"Recruiting efforts for separatist fighters are expanding inside Russia ,",826-898,131-140,_,_,_,_,_,_,_,0,0,0,_,0,0,0,0
UNSC_2014_SPV.7219_spch006_United_States_Of_America_06.txt,and separatists have openly said,901-933,141-145,_,_,_,_,_,_,_,0,0,0,_,0,0,0,0
UNSC_2014_SPV.7219_spch006_United_States_Of_America_06.txt,that they were looking for volunteers with experience in operating heavy weapons such as tanks and air defences .,936-1049,146-164,_,_,_,_,_,_,_,0,0,0,_,0,0,0,0
UNSC_2014_SPV.7219_spch006_United_States_Of_America_06.txt,Russia has allowed officials from the Donetsk People 's Republic,1052-1116,165-174,_,_,_,_,_,_,_,0,0,0,_,0,0,0,0
UNSC_2014_SPV.7219_spch006_United_States_Of_America_06.txt,to establish a recruiting office in Moscow .,1119-1163,175-182,_,_,_,_,_,_,_,0,0,0,_,0,0,0,0
UNSC_2014_SPV.7219_spch006_United_States_Of_America_06.txt,"Ukrainian pilot Nadia Savchenko ,",1166-1199,183-187,_,_,_,_,_,_,_,0,0,0,_,0,0,0,0
UNSC_2014_SPV.7219_spch006_United_States_Of_America_06.txt,"who has long had a distinguished career in the Ukrainian military ,",1202-1269,188-199,_,_,_,_,_,_,_,0,0,0,_,0,0,0,0
UNSC_2014_SPV.7219_spch006_United_States_Of_America_06.txt,was taken by separatists in mid - June .,1272-1312,200-208,_,_,_,_,_,_,_,0,0,0,_,0,0,0,0
UNSC_2014_SPV.7219_spch006_United_States_Of_America_06.txt,"She is now being held - where ? - in a prison in Voronezh , Russia .",1315-1383,209-225,_,_,_,_,_,_,_,0,0,0,_,0,0,0,0
UNSC_2014_SPV.7219_spch006_United_States_Of_America_06.txt,"According to the Ukrainian Government ,",1386-1425,226-231,_,_,_,_,_,_,_,0,0,0,_,0,0,0,0
UNSC_2014_SPV.7219_spch006_United_States_Of_America_06.txt,she was transferred to Russia by separatists .,1428-1474,232-239,_,_,_,_,_,_,_,0,0,0,_,0,0,0,0
UNSC_2014_SPV.7219_spch006_United_States_Of_America_06.txt,Russia continues to redeploy new forces extremely close to the Ukrainian border .,1477-1558,240-252,_,_,_,_,_,_,_,0,0,0,_,0,0,0,0
UNSC_2014_SPV.7219_spch006_United_States_Of_America_06.txt,"In addition , on Monday , a Ukrainian air force cargo plane was shot down in Ukrainian air space ,",1561-1659,253-272,_,_,_,_,_,_,_,0,0,0,_,0,0,0,0
UNSC_2014_SPV.7219_spch006_United_States_Of_America_06.txt,and on Wednesday a Ukrainian fighter jet was also shot down in Ukrainian air space .,1662-1746,273-288,_,_,_,_,_,_,_,0,0,0,_,0,0,0,0
UNSC_2014_SPV.7219_spch006_United_States_Of_America_06.txt,"In both instances ,",1749-1768,289-292,_,_,_,_,_,_,_,0,0,0,_,0,0,0,0
UNSC_2014_SPV.7219_spch006_United_States_Of_America_06.txt,the Ukrainian Government believes,1771-1804,293-296,_,_,_,_,_,_,_,0,0,0,_,0,0,0,0
UNSC_2014_SPV.7219_spch006_United_States_Of_America_06.txt,that the planes were fired on from Russian territory .,1807-1861,297-306,_,_,_,_,_,_,_,0,0,0,_,0,0,0,0
UNSC_2014_SPV.7138_spch009_China_01.txt,"The key to resolving the crisis in Ukraine is to act within the framework of law and order ,",0-92,0-18,_,_,_,_,_,_,_,0,0,0,_,0,0,0,0
UNSC_2014_SPV.7138_spch009_China_01.txt,"seeking an early solution to the differences through dialogue and negotiations ,",95-175,19-30,_,_,_,_,_,_,_,0,0,0,_,0,0,0,0
UNSC_2014_SPV.7138_spch009_China_01.txt,with due respect for the legitimate rights and interests of all those in the various communities and regions .,178-288,31-49,_,_,_,_,_,_,_,0,0,0,_,0,0,0,0
UNSC_2014_SPV.7138_spch009_China_01.txt,All parties should move forward in the overall aim of maintaining regional peace and stability,291-385,50-64,_,_,_,_,_,_,_,0,0,0,_,0,0,0,0
UNSC_2014_SPV.7138_spch009_China_01.txt,and of protecting the fundamental interests of all the communities in Ukraine,388-465,65-76,_,_,_,_,_,_,_,0,0,0,_,0,0,0,0
UNSC_2014_SPV.7138_spch009_China_01.txt,"in order to keep calm ,",468-491,77-82,_,_,_,_,_,_,_,0,0,0,_,0,0,0,0
UNSC_2014_SPV.7138_spch009_China_01.txt,exercise restraint,494-512,83-84,_,_,_,_,_,_,_,0,0,0,_,0,0,0,0
UNSC_2014_SPV.7138_spch009_China_01.txt,"and prevent a further escalation of the tension ,",515-564,85-93,_,_,_,_,_,_,_,0,0,0,_,0,0,0,0
UNSC_2014_SPV.7138_spch009_China_01.txt,while resolutely seeking a political solution,567-612,94-99,_,_,_,_,_,_,_,0,0,0,_,0,0,0,0
UNSC_2014_SPV.7138_spch009_China_01.txt,so as to find a specific way out as soon as possible .,615-669,100-112,_,_,_,_,_,_,_,0,0,0,_,0,0,0,0
UNSC_2014_SPV.7138_spch009_China_01.txt,China has been calling,673-695,113-116,_,_,_,_,_,_,_,0,0,0,_,0,0,0,0
UNSC_2014_SPV.7138_spch009_China_01.txt,for constructive efforts and the good offices of the international community to de - escalate the situation in Ukraine .,698-818,117-136,_,_,_,_,_,_,_,0,0,0,_,0,0,0,0
UNSC_2014_SPV.7138_spch009_China_01.txt,We note,821-828,137-138,_,_,_,_,_,_,_,0,0,0,_,0,0,0,0
UNSC_2014_SPV.7138_spch009_China_01.txt,the new developments and proposals in that regard .,831-882,139-147,_,_,_,_,_,_,_,0,0,0,_,0,0,0,0
UNSC_2014_SPV.7138_spch009_China_01.txt,Drafting a resolution at this juncture will only lead to confrontation,885-955,148-158,_,_,_,_,_,_,_,0,0,0,_,0,0,0,0
UNSC_2014_SPV.7138_spch009_China_01.txt,and further complicate the situation .,958-996,159-164,_,_,_,_,_,_,_,0,0,0,_,0,0,0,0
UNSC_2014_SPV.7138_spch009_China_01.txt,It is not in line with the common interests ofboth the people of Ukraine and the international community .,999-1105,165-183,_,_,_,_,_,_,_,0,0,0,_,0,0,0,0
UNSC_2014_SPV.7138_spch009_China_01.txt,"On the basis of the above , we could only abstain in the voting on the draft resolution ( S/2014/189 ) .",1108-1212,184-205,_,_,_,_,_,_,_,0,0,0,_,0,0,0,0
UNSC_2014_SPV.7138_spch009_China_01.txt,China holds a fair and impartial position on the issue of Ukraine .,1216-1283,206-218,_,_,_,_,_,_,_,0,0,0,_,0,0,0,0
UNSC_2014_SPV.7138_spch009_China_01.txt,We will continue to mediate,1286-1313,219-223,_,_,_,_,_,_,_,0,0,0,_,0,0,0,0
UNSC_2014_SPV.7138_spch009_China_01.txt,and to promote dialogue,1316-1339,224-227,_,_,_,_,_,_,_,0,0,0,_,0,0,0,0
UNSC_2014_SPV.7138_spch009_China_01.txt,so as to play a greater contructive role in seeking a political solution to the crisis in Ukraine .,1342-1441,228-246,_,_,_,_,_,_,_,0,0,0,_,0,0,0,0
UNSC_2014_SPV.7138_spch009_China_01.txt,"To that end , we would like to make three proposals .",1444-1497,247-258,_,_,_,_,_,_,_,0,0,0,_,0,0,0,0
UNSC_2014_SPV.7138_spch008_Rwanda_02.txt,"In that regard , we appeal to all conflicting blocs in Ukraine to pause a little ,",0-82,0-16,_,_,_,_,_,_,_,0,0,0,_,0,0,0,0
UNSC_2014_SPV.7138_spch008_Rwanda_02.txt,close their ears to all aggravating rhetoric,85-129,17-23,_,_,_,_,_,_,_,0,0,0,_,0,0,0,0
UNSC_2014_SPV.7138_spch008_Rwanda_02.txt,and give intercommunal talks a chance .,132-171,24-30,_,_,_,_,_,_,_,0,0,0,_,0,0,0,0
UNSC_2014_SPV.7138_spch008_Rwanda_02.txt,"If there is a need for credible mediators , the United Nations should rise to playing that role .",174-271,31-49,_,_,_,_,_,_,_,0,0,0,_,0,0,0,0
UNSC_2014_SPV.7138_spch008_Rwanda_02.txt,"Once again , we invite both sides to consider the mutual interests of the people of Ukraine",274-365,50-66,_,_,_,_,_,_,_,0,0,0,_,0,0,0,0
UNSC_2014_SPV.7138_spch008_Rwanda_02.txt,and to uphold their commitment to bilateral and multilateral agreements .,368-441,67-77,_,_,_,_,_,_,_,0,0,0,_,0,0,0,0
UNSC_2014_SPV.7138_spch008_Rwanda_02.txt,We call,444-451,78-79,Direct_NegEval,Underspecified,Other,-NONE-,_,_,_,1,0,1,a0_NE,1,0,0,0
