file_id,EDU_text,EDU_char_offsets,EDU_token_offsets,A0,A2,A3,A4,B1,B2,B3,Binary_a0_score,Binary_b1_score,Binary_Conflict_score,Three_Conflict_labels,Direct_NegEval,Indirect_NegEval,Challenge,Correction
UNSC_2014_SPV.7138_spch007_Lithuania_02.txt,they would boycott this illegal happening .,122-165,21-27,_,_,_,_,_,_,_,0,0,0,_,0,0,0,0
UNSC_2014_SPV.7138_spch007_Lithuania_02.txt,"All others who care for the sovereignty and indivisibility of the country ,",168-243,28-40,Indirect_NegEval,Underspecified,Law_Policy,-NONE-,_,_,_,1,0,1,a0_NE,0,1,0,0
UNSC_2014_SPV.7138_spch007_Lithuania_02.txt,"including Crimea 's Ukrainians ,",246-278,41-45,Indirect_NegEval,Underspecified,Law_Policy,-NONE-,_,_,_,1,0,1,a0_NE,0,1,0,0
UNSC_2014_SPV.7138_spch007_Lithuania_02.txt,"will be left voiceless by this hastily concocted plebiscite ,",281-342,46-55,Indirect_NegEval,Underspecified,Law_Policy,-NONE-,_,_,_,1,0,1,a0_NE,0,1,0,0
UNSC_2014_SPV.7138_spch007_Lithuania_02.txt,"because the "" yes "" option to Crimea 's future in Ukraine is simply not on the ballot .",345-432,56-74,Indirect_NegEval,Underspecified,Law_Policy,-NONE-,_,_,_,1,0,1,a0_NE,0,1,0,0
UNSC_2014_SPV.7138_spch007_Lithuania_02.txt,Our Russian colleague has spoken about self - determination and the independence of Crimea .,435-527,75-89,_,_,_,_,_,_,_,0,0,0,_,0,0,0,0
UNSC_2014_SPV.7138_spch007_Lithuania_02.txt,"Let me quote the self - proclaimed Prime Minister of Crimea , Aksyonov :",530-602,90-103,_,_,_,_,_,_,_,0,0,0,_,0,0,0,0
UNSC_2014_SPV.7138_spch007_Lithuania_02.txt,""" No , we will not have independence "" ,",605-645,104-113,_,_,_,_,_,_,_,0,0,0,_,0,0,0,0
UNSC_2014_SPV.7138_spch007_Lithuania_02.txt,"he said to the press ,",648-670,114-119,_,_,_,_,_,_,_,0,0,0,_,0,0,0,0
UNSC_2014_SPV.7138_spch007_Lithuania_02.txt,""" Crimea shouldjoin Russia "" ,",673-703,120-125,_,_,_,_,_,_,_,0,0,0,_,0,0,0,0
UNSC_2014_SPV.7138_spch007_Lithuania_02.txt,and it may happen in the next week or so .,706-748,126-136,_,_,_,_,_,_,_,0,0,0,_,0,0,0,0
UNSC_2014_SPV.7138_spch007_Lithuania_02.txt,It is in that context that the Council has voted for a draft resolution,751-822,137-150,Indirect_NegEval,Country,Law_Policy,russian_federation,_,_,_,1,0,1,a0_NE,0,1,0,0
UNSC_2014_SPV.7138_spch007_Lithuania_02.txt,"condemning the illegal referendum in Crimea ,",825-870,151-157,Indirect_NegEval,Country,Law_Policy,russian_federation,_,_,_,1,0,1,a0_NE,0,1,0,0
UNSC_2014_SPV.7138_spch007_Lithuania_02.txt,saying yes to the non - use of force in relations between the States ;,873-943,158-172,Indirect_NegEval,Country,Law_Policy,russian_federation,_,_,_,1,0,1,a0_NE,0,1,0,0
UNSC_2014_SPV.7138_spch007_Lithuania_02.txt,"yes to the sovereignty , territorial integrity , inviolability and political independence of Ukraine , and by way of extension , of any sovereign State .",946-1099,173-198,Indirect_NegEval,Country,Law_Policy,russian_federation,_,_,_,1,0,1,a0_NE,0,1,0,0
UNSC_2014_SPV.7138_spch007_Lithuania_02.txt,"My country 's yes to the draft resolution is a yes to non - aggression , to a nation 's free choice of its destiny and its alliances , to democracy , to the rule of law and to the internationally accepted rules of behaviour based on the norms and principles of international law .",1102-1382,199-253,_,_,_,_,_,_,_,0,0,0,_,0,0,0,0
UNSC_2014_SPV.7138_spch007_Lithuania_02.txt,Today 's veto is not business as usual .,1386-1426,254-262,_,_,_,_,_,_,_,0,0,0,_,0,0,0,0
UNSC_2014_SPV.7138_spch007_Lithuania_02.txt,"By vetoing the draft resolution ,",1429-1462,263-268,_,_,_,_,_,_,_,0,0,0,_,0,0,0,0
UNSC_2014_SPV.7138_spch007_Lithuania_02.txt,"built on the core tenants of the Charter of the United Nations ,",1465-1529,269-281,_,_,_,_,_,_,_,0,0,0,_,0,0,0,0
UNSC_2014_SPV.7138_spch007_Lithuania_02.txt,which clearly states,1532-1552,282-284,_,_,_,_,_,_,_,0,0,0,_,0,0,0,0
UNSC_2014_SPV.7138_spch007_Lithuania_02.txt,"that "" All members shall refrain in their international relations from the threat or use of force against the territorial integrity of political independence of any State , or in any other manner inconsistent for the Purposes of the United Nations """,1555-1804,285-326,_,_,_,_,_,_,_,0,0,0,_,0,0,0,0
UNSC_2014_SPV.7138_spch007_Lithuania_02.txt,"and that "" The parties to any dispute , the continuance of which is likely to endanger the maintenance of international peace and security , shall , first of all , seek a solution by negotiation , enquiry , mediation , conciliation , arbitration , judicial settlement , resort to regional agencies or arrangements or other peaceful means of their own choice "" .",1807-2168,327-390,_,_,_,_,_,_,_,0,0,0,_,0,0,0,0
UNSC_2014_SPV.7219_spch007_Lithuania_neg_02.txt,The Russian media channels are putting out ongoing anti - Ukrainian propaganda .,0-80,0-12,Indirect_NegEval,Country,Other,russian_federation,_,_,_,1,0,1,a0_NE,0,1,0,0
UNSC_2014_SPV.7219_spch007_Lithuania_neg_02.txt,"The mouthpiece of the separatists ,",83-118,13-18,Indirect_NegEval,Country,Non-Governm_Grp,-NONE-,_,_,_,1,0,1,a0_NE,0,1,0,0
UNSC_2014_SPV.7219_spch007_Lithuania_neg_02.txt,"Life News ,",121-132,19-21,Indirect_NegEval,Country,Non-Governm_Grp,-NONE-,_,_,_,1,0,1,a0_NE,0,1,0,0
UNSC_2014_SPV.7219_spch007_Lithuania_neg_02.txt,boasts of the agility of rebels to shoot down any plane in sight .,135-201,22-35,Indirect_NegEval,Country,Non-Governm_Grp,-NONE-,_,_,_,1,0,1,a0_NE,0,1,0,0
UNSC_2014_SPV.7219_spch007_Lithuania_neg_02.txt,The terrorists and separatists continue to take hostages .,204-262,36-44,Indirect_NegEval,Underspecified,Non-Governm_Grp,-NONE-,_,_,_,1,0,1,a0_NE,0,1,0,0
UNSC_2014_SPV.7219_spch007_Lithuania_neg_02.txt,The abducted and hooded Ukrainian pilot Nadia Savchenko was trafficked by separatists from Ukraine straight to the Russian Voronezh pretrial detention centre .,265-424,45-67,Indirect_NegEval,Country,Non-Governm_Grp,russian_federation,_,_,_,1,0,1,a0_NE,0,1,0,0
UNSC_2014_SPV.7219_spch007_Lithuania_neg_02.txt,We condemn,427-437,68-69,Direct_NegEval,Country,-NONE-,russian_federation,_,_,_,1,0,1,a0_NE,1,0,0,0
UNSC_2014_SPV.7219_spch007_Lithuania_neg_02.txt,the unlawful detention of Ukrainian citizens in Russia .,440-496,70-78,Direct_NegEval,Country,-NONE-,russian_federation,_,_,_,1,0,1,a0_NE,1,0,0,0
UNSC_2014_SPV.7219_spch007_Lithuania_neg_02.txt,Russia must respect the norms of international law,499-549,79-86,_,_,_,_,_,_,_,0,0,0,_,0,0,0,0
UNSC_2014_SPV.7219_spch007_Lithuania_neg_02.txt,and release Savchenko immediately .,552-587,87-91,_,_,_,_,_,_,_,0,0,0,_,0,0,0,0
UNSC_2014_SPV.7219_spch007_Lithuania_neg_02.txt,We remain appalled by the deteriorating human rights situation in Crimea .,590-664,92-103,Indirect_NegEval,Country,Other,russian_federation,_,_,_,1,0,1,a0_NE,0,1,0,0
UNSC_2014_SPV.7219_spch007_Lithuania_neg_02.txt,Lithuania urges,668-683,104-105,_,_,_,_,_,_,_,0,0,0,_,0,0,0,0
UNSC_2014_SPV.7219_spch007_Lithuania_neg_02.txt,"the holding of a full , thorough and independent investigation into the downing of the Malaysian Airlines flight ,",686-800,106-124,_,_,_,_,_,_,_,0,0,0,_,0,0,0,0
UNSC_2014_SPV.7219_spch007_Lithuania_neg_02.txt,as agreed today by the Council .,803-835,125-131,_,_,_,_,_,_,_,0,0,0,_,0,0,0,0
UNSC_2014_SPV.7219_spch007_Lithuania_neg_02.txt,Lithuania urges Russia,838-860,132-134,Indirect_NegEval,Country,Non-Governm_Grp,russian_federation,_,_,_,1,0,1,a0_NE,0,1,0,0
UNSC_2014_SPV.7219_spch007_Lithuania_neg_02.txt,"to unequivocally distance itself from any kind of direct or indirect support for terrorists , separatists and foreign fighters .",863-991,135-154,Indirect_NegEval,Country,Non-Governm_Grp,russian_federation,_,_,_,1,0,1,a0_NE,0,1,0,0
UNSC_2014_SPV.7219_spch007_Lithuania_neg_02.txt,The insurgents must lay down their weapons .,994-1038,155-162,_,_,_,_,_,_,_,0,0,0,_,0,0,0,0
UNSC_2014_SPV.7219_spch007_Lithuania_neg_02.txt,Lithuania calls on Russia,1041-1066,163-166,Indirect_NegEval,Country,Non-Governm_Grp,russian_federation,_,_,_,1,0,1,a0_NE,0,1,0,0
UNSC_2014_SPV.7219_spch007_Lithuania_neg_02.txt,to cooperate with Ukraine,1069-1094,167-170,Indirect_NegEval,Country,Non-Governm_Grp,russian_federation,_,_,_,1,0,1,a0_NE,0,1,0,0
UNSC_2014_SPV.7219_spch007_Lithuania_neg_02.txt,in order to ensure the security of the borders,1097-1143,171-179,Indirect_NegEval,Country,Non-Governm_Grp,russian_federation,_,_,_,1,0,1,a0_NE,0,1,0,0
UNSC_2014_SPV.7219_spch007_Lithuania_neg_02.txt,and to prevent weapons and armed terrorists from entering the territory of Ukraine .,1146-1230,180-193,Indirect_NegEval,Country,Non-Governm_Grp,russian_federation,_,_,_,1,0,1,a0_NE,0,1,0,0
UNSC_2014_SPV.7219_spch007_Lithuania_neg_02.txt,We call on Russia,1233-1250,194-197,_,_,_,_,_,_,_,0,0,0,_,0,0,0,0
UNSC_2014_SPV.7219_spch007_Lithuania_neg_02.txt,to constructively cooperate on the implementation of the peace plan put forward by President Petro Poroshenko .,1253-1364,198-214,_,_,_,_,_,_,_,0,0,0,_,0,0,0,0
UNSC_2014_SPV.7219_spch007_Lithuania_neg_02.txt,A diplomatic solution is possible .,1367-1402,215-220,_,_,_,_,_,_,_,0,0,0,_,0,0,0,0
UNSC_2014_SPV.7219_spch007_Lithuania_neg_02.txt,"Ukraine 's independence , sovereignty and territorial integrity within its internationally recognized borders ,",1405-1516,221-234,_,_,_,_,_,_,_,0,0,0,_,0,0,0,0
UNSC_2014_SPV.7219_spch007_Lithuania_neg_02.txt,"including Crimea ,",1519-1537,235-237,_,_,_,_,_,_,_,0,0,0,_,0,0,0,0
UNSC_2014_SPV.7219_spch007_Lithuania_neg_02.txt,are non - negotiable and must be respected by all .,1540-1591,238-248,_,_,_,_,_,_,_,0,0,0,_,0,0,0,0
UNSC_2014_SPV.7165_spch014_Australia_00.txt,I thank Under - Secretary - General Feltman for his briefing and his warning to the Council .,0-93,0-17,_,_,_,_,_,_,_,0,0,0,_,0,0,0,0
UNSC_2014_SPV.7165_spch014_Australia_00.txt,Australia strongly supported calls for the holding of tonight 's briefing,97-170,18-28,Direct_NegEval,Country,-NONE-,russian_federation,_,_,_,1,0,1,a0_NE,1,0,0,0
UNSC_2014_SPV.7165_spch014_Australia_00.txt,"to give the Council an up - to - date sense of the continuing destabilization and increased tensions in eastern Ukraine ,",174-295,29-50,Direct_NegEval,Country,-NONE-,russian_federation,_,_,_,1,0,1,a0_NE,1,0,0,0
UNSC_2014_SPV.7165_spch014_Australia_00.txt,much of which has evidently been sponsored and condoned by the Russian Federation .,299-382,51-64,Direct_NegEval,Country,-NONE-,russian_federation,_,_,_,1,0,1,a0_NE,1,0,0,0
UNSC_2014_SPV.7165_spch014_Australia_00.txt,"We , with the rest of the Council , welcomed",387-431,65-74,_,_,_,_,_,_,_,0,0,0,_,0,0,0,0
UNSC_2014_SPV.7165_spch014_Australia_00.txt,"the 17 April agreement reached in Geneva on steps to de - escalate the crisis ,",435-514,75-90,_,_,_,_,_,_,_,0,0,0,_,0,0,0,0
UNSC_2014_SPV.7165_spch014_Australia_00.txt,including commitments to refrain from further acts of violence and provocation .,518-598,91-102,_,_,_,_,_,_,_,0,0,0,_,0,0,0,0
UNSC_2014_SPV.7165_spch014_Australia_00.txt,That was a positive development,602-633,103-107,_,_,_,_,_,_,_,0,0,0,_,0,0,0,0
UNSC_2014_SPV.7165_spch014_Australia_00.txt,"and ,",637-642,108-109,_,_,_,_,_,_,_,0,0,0,_,0,0,0,0
UNSC_2014_SPV.7165_spch014_Australia_00.txt,"we hoped ,",646-656,110-112,_,_,_,_,_,_,_,0,0,0,_,0,0,0,0
UNSC_2014_SPV.7165_spch014_Australia_00.txt,a demonstration of serious commitment to reduce tensions,660-716,113-120,_,_,_,_,_,_,_,0,0,0,_,0,0,0,0
UNSC_2014_SPV.7165_spch014_Australia_00.txt,and work cooperatively towards a diplomatic and political solution to the crisis .,720-802,121-133,_,_,_,_,_,_,_,0,0,0,_,0,0,0,0
UNSC_2014_SPV.7219_spch010_Luxembourg_00.txt,"I also thank the Under - Secretary - General for Political Affairs , Mr. Jeffrey Feltman , for his briefing .",0-109,0-20,_,_,_,_,_,_,_,0,0,0,_,0,0,0,0
UNSC_2014_SPV.7219_spch010_Luxembourg_00.txt,"At the start ofmy remarks , Iwish to express ,",113-159,21-30,_,_,_,_,_,_,_,0,0,0,_,0,0,0,0
UNSC_2014_SPV.7219_spch010_Luxembourg_00.txt,"on behalf of the Government and the people of Luxembourg ,",162-220,31-41,_,_,_,_,_,_,_,0,0,0,_,0,0,0,0
UNSC_2014_SPV.7219_spch010_Luxembourg_00.txt,my most sincere condolences to the families and relatives of the 298 people aboard the Malaysia Airlines aircraft,223-336,42-59,_,_,_,_,_,_,_,0,0,0,_,0,0,0,0
UNSC_2014_SPV.7219_spch010_Luxembourg_00.txt,that crashed yesterday afternoon near the village of Grabovo in eastern Ukraine .,339-420,60-72,_,_,_,_,_,_,_,0,0,0,_,0,0,0,0
UNSC_2014_SPV.7219_spch010_Luxembourg_00.txt,Among the victims was a Dutch - English family living in Luxembourg .,423-492,73-85,_,_,_,_,_,_,_,0,0,0,_,0,0,0,0
UNSC_2014_SPV.7219_spch010_Luxembourg_00.txt,"Our sympathy also goes out to the Governments and the peoples of the Netherlands , Malaysia , Germany , Australia , Belgium , Canada , Indonesia , New Zealand , the Philippines and the United Kingdom .",495-696,86-122,_,_,_,_,_,_,_,0,0,0,_,0,0,0,0
UNSC_2014_SPV.7219_spch010_Luxembourg_00.txt,The international community owes it to the victims to shed light on the circumstances that led to this tragic event .,700-817,123-143,_,_,_,_,_,_,_,0,0,0,_,0,0,0,0
UNSC_2014_SPV.7219_spch010_Luxembourg_00.txt,A transparent and independent comprehensive international investigation must be completed as soon as possible .,820-931,144-158,_,_,_,_,_,_,_,0,0,0,_,0,0,0,0
UNSC_2014_SPV.7219_spch010_Luxembourg_00.txt,"Safe and unhindered access must be granted to international investigators , as well as to observers from the Organization for Security and Cooperation in Europe ( OSCE ) and representatives of affected countries .",934-1147,159-192,_,_,_,_,_,_,_,0,0,0,_,0,0,0,0
UNSC_2014_SPV.7219_spch010_Luxembourg_00.txt,All parties involved should fully cooperate to that end .,1150-1207,193-202,_,_,_,_,_,_,_,0,0,0,_,0,0,0,0
UNSC_2014_SPV.7219_spch010_Luxembourg_00.txt,We commend the Ukrainian authorities in that regard .,1210-1263,203-211,_,_,_,_,_,_,_,0,0,0,_,0,0,0,0
UNSC_2014_SPV.7219_spch010_Luxembourg_00.txt,Those who committed this heinous act must be held accountable .,1266-1329,212-222,_,_,_,_,_,_,_,0,0,0,_,0,0,0,0
UNSC_2014_SPV.7219_spch010_Luxembourg_00.txt,This air disaster took place in a context of the ongoing deterioration of the situation in the east of Ukraine .,1333-1445,223-243,_,_,_,_,_,_,_,0,0,0,_,0,0,0,0
UNSC_2014_SPV.7219_spch010_Luxembourg_00.txt,"Day after day , we receive reports of civilians killed in fighting between the Ukrainian armed forces and illegal armed groups .",1448-1576,244-265,Indirect_NegEval,Country,Non-Governm_Grp,russian_federation,_,_,_,1,0,1,a0_NE,0,1,0,0
UNSC_2014_SPV.7219_spch010_Luxembourg_00.txt,"The pro - Russian separatist militias continue to occupy buildings and border posts ,",1579-1664,266-279,Indirect_NegEval,Country,Non-Governm_Grp,russian_federation,_,_,_,1,0,1,a0_NE,0,1,0,0
UNSC_2014_SPV.7219_spch010_Luxembourg_00.txt,hold dozens of innocent people hostage,1667-1705,280-285,Indirect_NegEval,Country,Non-Governm_Grp,russian_federation,_,_,_,1,0,1,a0_NE,0,1,0,0
UNSC_2014_SPV.7219_spch010_Luxembourg_00.txt,"and threaten the territorial integrity , sovereignty and independence of Ukraine .",1708-1790,286-297,Indirect_NegEval,Country,Non-Governm_Grp,russian_federation,_,_,_,1,0,1,a0_NE,0,1,0,0
UNSC_2014_SPV.7219_spch010_Luxembourg_00.txt,"The living conditions ofpeople living in areas affected by the hostilities continue to deteriorate ,",1793-1893,298-312,Indirect_NegEval,Country,Non-Governm_Grp,russian_federation,_,_,_,1,0,1,a0_NE,0,1,0,0
UNSC_2014_SPV.7219_spch010_Luxembourg_00.txt,and the number of internally displaced persons has steadily increased .,1896-1967,313-323,Indirect_NegEval,Country,Non-Governm_Grp,russian_federation,_,_,_,1,0,1,a0_NE,0,1,0,0
UNSC_2014_SPV.7219_spch010_Luxembourg_00.txt,"The escalation of violence in recent days ,",1971-2014,324-331,Indirect_NegEval,Underspecified,Non-Governm_Grp,-NONE-,_,_,_,1,0,1,a0_NE,0,1,0,0
UNSC_2014_SPV.7219_spch010_Luxembourg_00.txt,"until its tragic climax yesterday ,",2017-2052,332-337,Indirect_NegEval,Underspecified,Non-Governm_Grp,-NONE-,_,_,_,1,0,1,a0_NE,0,1,0,0
UNSC_2014_SPV.7219_spch010_Luxembourg_00.txt,demonstrates once again that active armed groups in eastern Ukraine are actually well - equipped and well - trained paramilitary forces who enjoy clear external support .,2055-2225,338-364,Indirect_NegEval,Underspecified,Non-Governm_Grp,-NONE-,_,_,_,1,0,1,a0_NE,0,1,0,0
UNSC_2014_SPV.7138_spch017_Luxembourg_01.txt,"With regard to dialogue , in accordance with Chapter VI of the Charter of the United Nations , the draft resolution under consideration by the Council this morning was intended to urge all parties to seek a peaceful settlement immediately through direct political dialogue ,",0-274,0-44,_,_,_,_,_,_,_,0,0,0,_,0,0,0,0
UNSC_2014_SPV.7138_spch017_Luxembourg_01.txt,"to exercise restraint ,",277-300,45-48,_,_,_,_,_,_,_,0,0,0,_,0,0,0,0
UNSC_2014_SPV.7138_spch017_Luxembourg_01.txt,to refrain from any unilateral action and any inflammatory rhetoric that might increase tension,303-398,49-62,_,_,_,_,_,_,_,0,0,0,_,0,0,0,0
UNSC_2014_SPV.7138_spch017_Luxembourg_01.txt,and to engage fully in international mediation efforts .,401-457,63-71,_,_,_,_,_,_,_,0,0,0,_,0,0,0,0
UNSC_2014_SPV.7138_spch017_Luxembourg_01.txt,"However , the referendum",460-484,72-75,Indirect_NegEval,Underspecified,Law_Policy,-NONE-,_,_,_,1,0,1,a0_NE,0,1,0,0
UNSC_2014_SPV.7138_spch017_Luxembourg_01.txt,organized for tomorrow in Crimea,487-519,76-80,Indirect_NegEval,Underspecified,Law_Policy,-NONE-,_,_,_,1,0,1,a0_NE,0,1,0,0
UNSC_2014_SPV.7138_spch017_Luxembourg_01.txt,is intended to change the status of the Ukrainian territory against the will of Ukraine .,522-611,81-96,Indirect_NegEval,Underspecified,Law_Policy,-NONE-,_,_,_,1,0,1,a0_NE,0,1,0,0
UNSC_2014_SPV.7138_spch017_Luxembourg_01.txt,"If the referendum were to take place ,",614-652,97-104,Indirect_NegEval,Underspecified,Law_Policy,-NONE-,_,_,_,1,0,1,a0_NE,0,1,0,0
UNSC_2014_SPV.7138_spch017_Luxembourg_01.txt,it would constitute a unilateral act,655-691,105-110,Indirect_NegEval,Underspecified,Law_Policy,-NONE-,_,_,_,1,0,1,a0_NE,0,1,0,0
UNSC_2014_SPV.7138_spch017_Luxembourg_01.txt,that could very seriously destabilize Ukraine and the entire the region .,694-767,111-122,Indirect_NegEval,Underspecified,Law_Policy,-NONE-,_,_,_,1,0,1,a0_NE,0,1,0,0
UNSC_2014_SPV.7138_spch017_Luxembourg_01.txt,"Pursuant to the Charter of the United Nations , Member States have conferred upon the Security Council the primary responsibility for maintaining international peace and security .",771-951,123-149,_,_,_,_,_,_,_,0,0,0,_,0,0,0,0
UNSC_2014_SPV.7138_spch017_Luxembourg_01.txt,"Today , the Russian veto prevented the Security Council from assuming that responsibility in the interest of peace and security in Ukraine and Europe .",954-1105,150-174,Direct_NegEval,Country,-NONE-,russian_federation,_,_,_,1,0,1,a0_NE,1,0,0,0
UNSC_2014_SPV.7138_spch017_Luxembourg_01.txt,The referendum,1109-1123,175-176,Indirect_NegEval,Underspecified,Law_Policy,-NONE-,_,_,_,1,0,1,a0_NE,0,1,0,0
UNSC_2014_SPV.7138_spch017_Luxembourg_01.txt,organized for tomorrow in Crimea,1126-1158,177-181,Indirect_NegEval,Underspecified,Law_Policy,-NONE-,_,_,_,1,0,1,a0_NE,0,1,0,0
UNSC_2014_SPV.7138_spch017_Luxembourg_01.txt,"runs contrary to Ukraine 's Constitution ,",1161-1203,182-188,Indirect_NegEval,Underspecified,Law_Policy,-NONE-,_,_,_,1,0,1,a0_NE,0,1,0,0
UNSC_2014_SPV.7138_spch017_Luxembourg_01.txt,which stipulates that the territory of Ukraine is indivisible and inviolable .,1206-1284,189-200,Indirect_NegEval,Underspecified,Law_Policy,-NONE-,_,_,_,1,0,1,a0_NE,0,1,0,0
UNSC_2014_SPV.7138_spch017_Luxembourg_01.txt,The referendum is also contrary to the Constitution of the Autonomous Republic of Crimea .,1287-1377,201-215,Indirect_NegEval,Underspecified,Law_Policy,-NONE-,_,_,_,1,0,1,a0_NE,0,1,0,0
UNSC_2014_SPV.7138_spch017_Luxembourg_01.txt,The international community can in no way recognize its outcome .,1380-1445,216-226,Indirect_NegEval,-NONE-,Law_Policy,-NONE-,_,_,_,1,0,1,a0_NE,0,1,0,0
UNSC_2016_SPV.7658_spch015_China_01.txt,"Secondly , greater efforts should be deployed to find political solutions to critical regional issues ,",1-104,0-15,_,_,_,_,_,_,_,0,0,0,_,0,0,0,0
UNSC_2016_SPV.7658_spch015_China_01.txt,and greater importance attached to the role of women in conflict resolution .,107-184,16-28,_,_,_,_,_,_,_,0,0,0,_,0,0,0,0
UNSC_2016_SPV.7658_spch015_China_01.txt,The international community should work hard to help design political solutions to conflicts and overcome differences through dialogue .,187-323,29-47,_,_,_,_,_,_,_,0,0,0,_,0,0,0,0
UNSC_2016_SPV.7658_spch015_China_01.txt,Women should be encouraged to become important players in mediation,326-393,48-57,_,_,_,_,_,_,_,0,0,0,_,0,0,0,0
UNSC_2016_SPV.7658_spch015_China_01.txt,and to fully leverage their advantages in advocating a culture of peace .,396-469,58-70,_,_,_,_,_,_,_,0,0,0,_,0,0,0,0
UNSC_2016_SPV.7658_spch015_China_01.txt,United Nations peacekeeping operations may also steadily raise the percentage of female staff,472-565,71-83,_,_,_,_,_,_,_,0,0,0,_,0,0,0,0
UNSC_2016_SPV.7658_spch015_China_01.txt,so that communication with local women and girls can be improved .,568-634,84-95,_,_,_,_,_,_,_,0,0,0,_,0,0,0,0
UNSC_2016_SPV.7658_spch015_China_01.txt,"Thirdly , women should be given a greater role to play in building a culture of harmony and inclusiveness .",638-745,96-115,_,_,_,_,_,_,_,0,0,0,_,0,0,0,0
UNSC_2016_SPV.7658_spch015_China_01.txt,"The international community should encourage women to play a greater role in social life ,",749-839,116-130,_,_,_,_,_,_,_,0,0,0,_,0,0,0,0
UNSC_2016_SPV.7658_spch015_China_01.txt,and it should educate young people,842-876,131-136,_,_,_,_,_,_,_,0,0,0,_,0,0,0,0
UNSC_2016_SPV.7658_spch015_China_01.txt,so that they can resist the ideological influence of violent extremism and the demagogic rhetoric of armed groups and terrorists .,879-1009,137-157,_,_,_,_,_,_,_,0,0,0,_,0,0,0,0
UNSC_2016_SPV.7658_spch015_China_01.txt,"Women should be empowered to fully participate in all phases of post - conflict reconstruction , actively encourage the disarmament , demobilization and reintegration process of combatants , and provide counselling and community support for victims of violence .",1012-1274,158-196,_,_,_,_,_,_,_,0,0,0,_,0,0,0,0
UNSC_2016_SPV.7658_spch015_China_01.txt,"Fourthly , women must be enabled to promote economic and social development ,",1278-1355,197-209,_,_,_,_,_,_,_,0,0,0,_,0,0,0,0
UNSC_2016_SPV.7658_spch015_China_01.txt,thereby eliminating the roots causes ofconflict .,1358-1407,210-216,_,_,_,_,_,_,_,0,0,0,_,0,0,0,0
UNSC_2016_SPV.7658_spch015_China_01.txt,"The international community should step up economic empowerment efforts for African women ,",1410-1501,217-229,_,_,_,_,_,_,_,0,0,0,_,0,0,0,0
UNSC_2016_SPV.7658_spch015_China_01.txt,help African countries reduce poverty,1504-1541,230-234,_,_,_,_,_,_,_,0,0,0,_,0,0,0,0
UNSC_2016_SPV.7658_spch015_China_01.txt,and promote economic development .,1544-1578,235-239,_,_,_,_,_,_,_,0,0,0,_,0,0,0,0
UNSC_2016_SPV.7658_spch015_China_01.txt,African women should be provided with better occupational - skills training and with greater funding support for entrepreneurship,1581-1710,240-257,_,_,_,_,_,_,_,0,0,0,_,0,0,0,0
UNSC_2016_SPV.7658_spch015_China_01.txt,"in order to comprehensively improve incomes and livelihoods ,",1713-1774,258-266,_,_,_,_,_,_,_,0,0,0,_,0,0,0,0
UNSC_2016_SPV.7658_spch015_China_01.txt,"with a view to promoting the industrialization and agricultural modernization of the continent ,",1777-1873,267-280,_,_,_,_,_,_,_,0,0,0,_,0,0,0,0
UNSC_2016_SPV.7658_spch015_China_01.txt,thereby eradicating the root causes of conflict .,1876-1925,281-288,_,_,_,_,_,_,_,0,0,0,_,0,0,0,0
UNSC_2016_SPV.7658_spch015_China_01.txt,"Last September , the Global Summit of Women was convened under a joint China - United Nations initiative .",1929-2035,289-307,_,_,_,_,_,_,_,0,0,0,_,0,0,0,0
UNSC_2014_SPV.7154_spch006_United_States_Of_AmericaA_02_GD.txt,"We continue efforts to de - escalate the situation in Ukraine and find a diplomatic path forward ,",0-98,0-17,_,_,_,_,_,_,_,0,0,0,_,0,0,0,0
UNSC_2014_SPV.7154_spch006_United_States_Of_AmericaA_02_GD.txt,"which is why Secretary Kerry will participate in the Geneva talks on 17 April ,",101-180,18-32,_,_,_,_,_,_,_,0,0,0,_,0,0,0,0
UNSC_2014_SPV.7154_spch006_United_States_Of_AmericaA_02_GD.txt,which will include Russian Foreign Minister Lavrov .,183-235,33-40,_,_,_,_,_,_,_,0,0,0,_,0,0,0,0
UNSC_2014_SPV.7154_spch006_United_States_Of_AmericaA_02_GD.txt,"But ifthose are to be successful , Russia will have to explain why its forces continue to mass on the Ukrainian border - at least 40,000 forces -",238-383,41-68,Direct_NegEval,Country,-NONE-,russian_federation,_,_,_,1,0,1,a0_NE,1,0,0,0
UNSC_2014_SPV.7154_spch006_United_States_Of_AmericaA_02_GD.txt,and it will have to come with constructive ideas on how to de - escalate and resolve the armed attacks on buildings in eastern Ukraine .,386-522,69-94,_,_,_,_,_,_,_,0,0,0,_,0,0,0,0
UNSC_2014_SPV.7154_spch006_United_States_Of_AmericaA_02_GD.txt,The United States stands with Ukraine and the fundamental principle that the future of Ukraine must be decided by the Ukrainian people .,526-662,95-117,_,_,_,_,_,_,_,0,0,0,_,0,0,0,0
UNSC_2014_SPV.7154_spch006_United_States_Of_AmericaA_02_GD.txt,We also stand with international law and norms and the fundamental principle that borders are not suggestions .,665-776,118-135,_,_,_,_,_,_,_,0,0,0,_,0,0,0,0
UNSC_2014_SPV.7154_spch006_United_States_Of_AmericaA_02_GD.txt,"On Monday , we will conclude the $ 1 billion loan guarantee for Ukraine .",779-852,136-150,_,_,_,_,_,_,_,0,0,0,_,0,0,0,0
UNSC_2014_SPV.7154_spch006_United_States_Of_AmericaA_02_GD.txt,"That will benefit all the Ukrainian people , including minorities .",855-922,151-161,_,_,_,_,_,_,_,0,0,0,_,0,0,0,0
UNSC_2014_SPV.7154_spch006_United_States_Of_AmericaA_02_GD.txt,"Next week , Vice - President Biden will visit Ukraine .",925-980,162-172,_,_,_,_,_,_,_,0,0,0,_,0,0,0,0
